,Datetime,Text
1399,2020-04-29 23:56:34+00:00,"“People need to work” I know, I’m one of them. But A) It wouldnt be practical & B) it would alter the core of what we do and the reason people come here in the first place. If COVID protectvie wear has to be worn, we shouldn’t open "
1400,2020-04-29 23:56:34+00:00,Clinical and virological data of the first cases of COVID-19 in Europe: a case series https://www.thelancet.com/journals/laninf/article/PIIS1473-3099(20)30200-0/fulltext#.XqoUG797lZ4.twitter { @DadyChery
1401,2020-04-29 23:56:34+00:00,I love hearing people’s made up conspiracy theories about COVID-19. It keeps me entertained.
1402,2020-04-29 23:56:33+00:00,The med Trump randomly recommended and kills COVID patients
1403,2020-04-29 23:56:33+00:00,DOG TESTS POSITIVE FOR CORONAVIRUS North Carolina pet believed to be first dog in the U.S. to test positive for virus that causes COVID-19 in humans 
1404,2020-04-29 23:56:33+00:00,"Now, world fighting 3 pandemic Covid-19, stupidity and Donal Trump"
1405,2020-04-29 23:56:32+00:00,"Eu namoro à distância, o ruim do covid-19 é que ela viria me visitar em breve."
1406,2020-04-29 23:56:32+00:00,Coronavirus en la Argentina: los síntomas del Covid-19 que desafían a los médicos http://dlvr.it/RVjrdS
1407,2020-04-29 23:56:32+00:00,@edufeiok soy médico del Hospital Iriarte estoy de guardia en este momento y hay un compañero de clínica Médica positivo por Covid.
1408,2020-04-29 23:56:32+00:00,"I can report @AlboMP that the people on Jobseeker are receiving payments, so far I have had the initial $750 one off, and yesterday the first of the increased regular Jobseeker payments, but I was on Newstart (DES) before COVID-19."
1409,2020-04-29 23:56:32+00:00,I lived here in Italy the first western covid spread and can confirm that all the needed information from China was public for months. spread in european countries is 100% caused by health systems not ready for a huge pandemic. funny how there's people trying to rewrite the story
1410,2020-04-29 23:56:32+00:00,También es inadmisible que la prensa se venda al mejor postor “grupos económicos y políticos” la prensa habla de la corrupción de #RafaelCorrea pero que raro que durante los 6 años de #Lenin en el poder nunca hubo corrupción solo en los 4 últimos años !! #Covid_19
1411,2020-04-29 23:56:32+00:00,"Covid-19 Accelerates ""#Streaming Wars"". Cash-Rich Netflix Stays #1 By Buying Best Original Content. Who Else Wins? @netflix @YouTube @Kartemquin @Participant @hbogo @natgeodocs @Medill_Doc @A24 @MagnoliaPics @POVdocs @Roku @iTunesTV @Sling @neonrated @OrigThinkers @Mountainfilm https://twitter.com/quotesrainsite/status/1252039789861355521"
1412,2020-04-29 23:56:32+00:00,Yes I personally know a RN who has CoVid 19
1413,2020-04-29 23:56:32+00:00,When did you first get Covid?
1414,2020-04-29 23:56:32+00:00,#en casa me siento mejor para terminar pronto con el covid
1415,2020-04-29 23:56:32+00:00,Pharma Companies Agree to COVID-19 Cease-Fire With Bench Trial on Hold 
1416,2020-04-29 23:56:32+00:00,"Honestly, the world post-covid terrifies me more than everything else. Global economy, trade, culture... Everything will change for better or for worse."
1417,2020-04-29 23:56:32+00:00," #CoglioniVirus, tutto il Peggio del #COVID__19 "
1418,2020-04-29 23:56:32+00:00,5 Civil Rights Americans Lost to the COVID-19 Panic 
1419,2020-04-29 23:56:31+00:00,"We MUST unify and vote against Trump on November 3, 2020. Even if it means to crawl on broken glasses through a COVID-19 ward to vote against this incompetent and deranged Orange menace, we will do it. Let’s remember the importance of this 2020 election!!"
1420,2020-04-29 23:56:31+00:00,The good news is that if you smell rain then you don’t have COVID !
1421,2020-04-29 23:56:31+00:00,COVID-19の歌は草
1422,2020-04-29 23:56:31+00:00,"Se supone el virus se mueve con la gente, si ahi no entran visitas, no puede haber covid-19"
1423,2020-04-29 23:56:31+00:00,"I suppose my question is whether the government could be doing more? I think they can and the core problems with the system are not new, despite COVID-19. We've been telling our political leaders, from all major parties the same thing for around a decade now... 4/x"
1424,2020-04-29 23:56:30+00:00,É hora de ISOLAMENTO TOTAL. Brasileiro deveria ter uma educação melhor. Não respeitam nada sobre isolamento social. Vizinhos fazendo festas e resenhas. Vai chegar o colapso total. #PandemiaMundial #Covid_19 #FicaEmCasa
1425,2020-04-29 23:56:30+00:00," Dr. Jim Roach MD, known as “America’s Healer.” Learn the latest information on cancer with VITAL STRATEGIES IN CANCER, plus THE BEST preventative vitamins and supplements for COVID-19. “Support Protocols During High Virus Season”. http://erskineradio.com &amp; Podcasts"
1426,2020-04-29 23:56:30+00:00,"Infórmate bien, conoce el boletín del COVID-19 en Córdoba. Hoy 29 de Abril a las 6: 55 pm, Córdoba registra 26 casos de coronavirus entre ellos 3 fallecidos y 10 recuperados. #CórdobaSeQuedaEnCasa @walter_galeno"
1427,2020-04-29 23:56:30+00:00,meu tio e meu primo deram positivo pra covid-19. 
1428,2020-04-29 23:56:30+00:00,More than 80% of hospitalized COVID-19 patients in Georgia last month were bl... https://www.plow.io/post/more-than-80-of-hospitalized-covid-19-patients-in-georgia-last-month-were-black-cdc-study-finds?utm_source=Twitter&amp;utm_campaign=Health +1 VigorBot #Health
1429,2020-04-29 23:56:29+00:00,Trump demands huge compensation from China over COVID-19 pandemic failure https://youtu.be/viqHbsJ7xUU via @YouTube
1430,2020-04-29 23:56:29+00:00,"https://youtu.be/8xk1P1913y0 ... At least 2 times a day for the past few weeks, Ray has been getting me to and from work with America the Beautiful. Chills each and every time. Americans have come together, been made stronger, and will come out of #covid for the better! "
1431,2020-04-29 23:56:29+00:00,Debería decir “Contagiados por SARS-CoV-2” que no es lo mismo que enfermo de COVID-19. Es una definición de la OMS no mía.
1432,2020-04-29 23:56:29+00:00,Te compartimos algunas ideas de actividades que puedes realizar la contingencia por el COVID-19. Para mantenerte informado visita http://www.covid19honduras.org/ #HondurasQuédateEnCasa
1433,2020-04-29 23:56:29+00:00,"I wish someone would explain how the Bible and believing God’s word is protection from COVID-19? I follow my own spiritual path, but I live in the Bible Belt. The MAGAs are excited about the mall opening Friday and are SURE the Bible will protect them. #VoteBlue"
1434,2020-04-29 23:56:29+00:00,"Dear @alyankovic: I have never heard of you, but my dad says that you are the best to ever get in the parody game. So, I wondered if you'd watch our #BiggieSmalls parody, ""The 10 COVID Commandments."" "
1435,2020-04-29 23:56:29+00:00,"Hola, soy las mascarillas defectuosas del Gobierno, quizás me recuerdes de cagadas anteriores como los test defectuosos, el 8M, el COVID ""gripe"" o Pablo Iglesias vicepresidente "
1436,2020-04-29 23:56:29+00:00,When inspiration and COVID hit.. #QuarantineQueen
1437,2020-04-29 23:56:29+00:00,"@QuinteroCalle Sr Alcalde, sabemos que muchos sectores se encuentran paralizados por todo el tema del COVID-19. En WeGoo estamos trabajando en un protocolo de bioseguridad que nos permitirá reactivar todo el sector de belleza en Medellín. Necesitamos de su apoyo. @AlcaldiadeMed"
1438,2020-04-29 23:56:29+00:00,Aprueban diputados que venta de inmuebles sea para paliar efectos del COVID-19 #Michoacán
1439,2020-04-29 23:56:28+00:00,"@A_VCarranza @Claudiashein @JesusMartinMx una denuncia, están haciendo práctica de boxeo en el parque de los periodistas ilustres metro fray Servando #coronavirus #Covid_19 ya se permite salir??"
1440,2020-04-29 23:56:28+00:00,It’s time for the world to join together in a global effort to beat #COVID-19. @sebastiankurz will Austria step up alongside other global leaders to support @CEPIvaccines and @gavi in their work to defeat deadly global pandemics? #VaccinesWork #DefeatDiseaseTogether
1441,2020-04-29 23:56:28+00:00,Hps los está matando el covid-19 y ni así dejan de joder con Venezuela
1442,2020-04-29 23:56:28+00:00,Natural selection of the covid-19 kind (1) - https://www.sunnewsonline.com/natural-selection-of-the-covid-19-kind-1-2/
1443,2020-04-29 23:56:28+00:00,"Napanood ko sa news kanina. Pero wala pang official announcement. Parang if ever maging ok na ang covid situation, ipapa-prioritize nila ang local tourism."
1444,2020-04-29 23:56:28+00:00,Enseñanzas del COVID-19. II Autoconocimiento 
1445,2020-04-29 23:56:28+00:00,Greed will kill more people than Covid-19 https://www.ugnews24.info/opinion/greed-will-kill-more-people-than-covid-19/
1446,2020-04-29 23:56:28+00:00,#CoronaVirus- Emergency Hygiene Supplies to Communities in #Haiti #Covid19 #Covid-19 #stcharlesfunds #Monsterfunders Please Help #Fund Today to my #4giving #PLZ RT! Click Below
1447,2020-04-29 23:56:28+00:00,"[Yet w/o knowing the issues a few in the community blamed Ds. Tribal governments were supposed to get $8 billion in emergency COVID-19 aid from the CARES Act. More than a month later, they still haven't gotten any. https://www.huffpost.com/entry/tribes-covid-19-federal-relief-treasury-deb-haaland_n_5ea9decac5b633a8544487d9?ncid=engmodushpmg00000004 via @HuffPostPol"
1448,2020-04-29 23:56:28+00:00,"[Update: Reopening plans] Best Buy closing all stores, shifting to curbside pickup due to COVID-19 https://techfans.co.uk/update-reopening-plans-best-buy-closing-all-stores-shifting-to-curbside-pickup-due-to-covid-19/"
1449,2020-04-29 23:56:27+00:00,"""#UniSA is in the box seat to help South Australia become the powerhouse of Australian manufacturing post #Covid_19 and ensure sovereign capability"" http://ow.ly/tGOy50zssZD"
1450,2020-04-29 23:56:27+00:00,"A mitad de semana tenemos noticias sorprendentes que deben saber sobre el COVID-19, te las compartimos en los 47 del día #QuédatenEnCasa #HalconesResponsables"
1451,2020-04-29 23:56:27+00:00,Phuwin (new cast) said to his IG live that prolly TGG will be aired next yeat bcs there are soms scenes that havent been film and halted due to covid.
1452,2020-04-29 23:56:27+00:00,"when we reached out to Ian Anderson @jethrotull to help us with this #Covid-19 PSA, he stepped up to the plate. Try watching without tears. https://youtu.be/-pLmhtGrbKk"
1453,2020-04-29 23:56:27+00:00,"El fármaco remdesivir ""tiene un claro efecto positivo"" en la recuperación de pacientes con covid-19, afirma el principal infectólogo de EE.UU. "
1454,2020-04-29 23:56:27+00:00,"""e daí?"" (presidente do Brasil, 2020, sobre os mortos por COVID-19) "
1455,2020-04-29 23:56:27+00:00,"Chale, el covid ya llegó a mi municipio "
1456,2020-04-29 23:56:26+00:00,"Random discovery: The Andromeda Strain (the film, not the novel) was released 12 March 1971. The first COVID-19 stay-at-home order (California's) was on 18 March 2020. Almost but not quite 50 years later. Pure coincidence, but an interesting one nonetheless."
1457,2020-04-29 23:56:26+00:00,"Lo siento pero nadie tiene un caso leve de COVID-19 de qué está hablando este tipo, Y siguen engañando a la gente con este tipo de conferencias de prensa, deberían de tomar esto con más seriedad. Que vean los casos latentes que hay y en otras ciudades de otros países "
1458,2020-04-29 23:56:26+00:00,[EN DIRECTE] Catalunya registra el rècord de casos de Covid-19 i suma 138 morts 
1459,2020-04-29 23:56:26+00:00,Covid 19
1460,2020-04-29 23:56:26+00:00,@tacoflash que bueno que este concierto no se cancela por COVID 
1461,2020-04-29 23:56:26+00:00,The latest article in @HRDAustralia reports on the data @ELMO_Software have uncovered on the changing patterns of information consumption across organisations as they look for assistance to better support their remote workforce through COVID-19 http://hubs.ly/H0pZ3Y10.
1462,2020-04-29 23:56:26+00:00,"I hope everyone is staying safe during the COVID-19 Pandemic, virtual Spring Practice came to an end to day. Congrats to @AyeeeJay4 and @marcusc064 and all the Wide Receivers at the third semi-annual Lycoming College Wide Receiver Awards. Exceed The Standard."
1463,2020-04-29 23:56:25+00:00,"Na linha de frente contra Covid-19, médico se fantasia de dinossauro para abraçar filho https://flaviochaves.com.br/2020/04/29/na-linha-de-frente-contra-covid-19-medico-se-fantasia-de-dinossauro-para-abracar-filho/"
1464,2020-04-29 23:56:25+00:00,Así con la #cuarentena #Covid_19 #coronavirus
1465,2020-04-29 23:56:24+00:00,"We need to begin to pressure our government to give us choice back, stop emergency procedures. Ppl cannot be arrested for jogging. This is becoming insane. If you’re afraid stay home and let the rest of us move forward!!! #canada #Ontario #covid"
1466,2020-04-29 23:56:24+00:00,Donc là y’a eu un essai clinique du remdesivir contre le covid-19 menés par Gilead Sciences (connu pour des méfaits incroyables) qui au debut étaient un échec complet .. et une semaine après c’est une réussite ??? Les USA s’en félicite. Nous sommes de reels clowns quoi.
1467,2020-04-29 23:56:24+00:00,#CoronaVirus- Emergency Hygiene Supplies to Communities in #Haiti #Covid19 #Covid-19 #stcharlesfunds #Monsterfunder Please #Donate Today to my #4giving #PLZ RT! Click Below
1468,2020-04-29 23:56:24+00:00,"@HYDROGYN Issue Special Covid-19 Song ""Hostage"" Check it out here http://www.knac.com/article.asp?ArticleID=36070 #knac #purerock"
1469,2020-04-29 23:56:24+00:00,"@VP I know you are a dog lover, so ""what do I have to lose?"" I've been tweeting Potus and Lara Trump against china's Yulin dogmeat ""festival"" in china, a monumental atrocity/excuse for torture/bloodlust. Pls don't look away from this suffering; covid danger "
1470,2020-04-29 23:56:24+00:00,Los nombres de personas más curiosos que ha dejado el covid-19 
1471,2020-04-29 23:56:23+00:00,"YES YES YES!!!!!!, I'm not gonna make light of the covid lockdown(in my city) but binge watching this me season will make it a little easier, I'm running out of shows to binge, and hair to pull out due to boredom "
1472,2020-04-29 23:56:23+00:00,o número de casos do covid na minha cidade aumentando o hospital daqui não tem uma dipirona EU VOU MORRER
1473,2020-04-29 23:56:23+00:00,"Há muita desinformação sobre a covid 19 e muita gente desesperada tomando medidas sem embasamento científico. Sei que é frustrante lidarmos com um inimigo que ainda sabemos muito pouco sobre, mas todo dia novas pesquisas estão sendo publicadas e novas drogas sendo testadas, mas"
1474,2020-04-29 23:56:23+00:00,"Unpopular opinion, COVID-19 kinda sucks"
1475,2020-04-29 23:56:23+00:00,Joined a game with friends from college last week on PokerStars + Zoom and it was great. COVID finally forced home games online and it’s a trend I can see sticking @TheStalwart
1476,2020-04-29 23:56:23+00:00,#OtraVezMienten Los de cambiemos se la pasan en las redes con las teorías conspirativas. En Youtube se la pasan publicando sobre la élite del poder mundial jajaja Instalan que el covid-19 fue creado por @CFKArgentina los chinos y los rusos @alferdez es parte con el Papa jaja
1477,2020-04-29 23:56:23+00:00,"Mais grave ainda foi ele ter tido na TV a baboseira que disse, quando muitos o ouviram e devem ter pego Covid."
1478,2020-04-29 23:56:22+00:00,Oscar Chávez tiene Covid-19 En cantante mexicano fue internado en el hospital 20 de noviembre de la Ciudad de México. Acaba de cumplir 85 años de edad. 
1479,2020-04-29 23:56:22+00:00,"Tom Holland: ""China permitió la expansión del Covid-19 y Occidente no lo olvidará"" https://mirdig.wordpress.com/2020/04/29/tom-holland-china-permitio-la-expansion-del-covid-19-y-occidente-no-lo-olvidara/ vía @MarianoPlanells"
1480,2020-04-29 23:56:22+00:00,Mobile COVID-19 testing center traveling to select Ga. counties next week 
1481,2020-04-29 23:56:22+00:00,"Taktau kenapa tadi baring tetiba teringat the day my dad passed away and i got emotional. Ended up takleh tido so keluar bilik join umi tengok tanyalah ustaz. Tapi bila dengar dia share pasal arwah ayah dia meninggal sebab covid, terus aku makin sedih "
1482,2020-04-29 23:56:22+00:00,@dougducey You're decision to delay opening AZ is destroying AZ Small Business. Your COVID numbers are a lie!!! YOU ARE A TYPICAL SPINELESS POLITICIAN. You will be PRIMARIED!!!!!
1483,2020-04-29 23:56:22+00:00,"según yo, hay más de 60 mil personas contagiadas con Covid 19. #Chile"
1484,2020-04-29 23:56:21+00:00,That’s Quarantine baby #mentalhealthawareness #mentalhealthmatters #mentalhealth #mentalhealthsupport #panicattack #panicattacks #quarantine #covid #covidmentalhealth
1485,2020-04-29 23:56:21+00:00,Btw the aliens now have covid-19 and all left earth. 
1486,2020-04-29 23:56:21+00:00,@AmbLiuXiaoMing You lied on Hardtalk China tried to cover up the Covid-19 virus release in Wuhan. The world is not as stupid as you give it credit for. #ChinaLiedPeopleDie
1487,2020-04-29 23:56:21+00:00,Mayo Clinic COVID-19 self assessment tool - 
1488,2020-04-29 23:56:21+00:00, They are fast to mobilize a mobile court for COVID-19 lockdown defaulters but become blind when it's turn to mobilize contractors to fix Aba. Si nkwi
1489,2020-04-29 23:56:21+00:00,"a ann antes de namorar comigo tava ficando com um doutorando de medicina anti bolsonaro que tá participando atualmente das pesquisas sobre o covid-19, e ela acabou de me falar que queria muito falar com ele sobre pq ctz que tem coisa que ele sabe que não saiu na mídia ainda +"
1490,2020-04-29 23:56:21+00:00,Nothing wrong with me I created this account to help people. If you get really sick with COVID 19 and might die or know someone who you care about might. At least you have the information to make the decision do I want try this what do I have to lose.
1491,2020-04-29 23:56:21+00:00,The economic impacts of COVID-19 may have a hidden impact on children — it may help them develop a money mindset earlier. 
1492,2020-04-29 23:56:21+00:00,Calgary Herald: Filipino workers face backlash in towns over COVID-19 outbreaks at packing plants. https://calgaryherald.com/news/filipino-employees-not-to-blame-for-meat-packing-plant-outbreaks-that-have-surpassed-1000-cases via @GoogleNews
1493,2020-04-29 23:56:21+00:00,"O doido, vão me denunciar naquele insta do covid, eu tenho certeza KKKKKKKKKKKKKKKKKKKKKK"
1494,2020-04-29 23:56:21+00:00,"Madhya Pradesh Coronavirus Updates: 2,560 COVID-19 infected in Madhya Pradesh; 130 dead "
1495,2020-04-29 23:56:21+00:00,.@CARD_ISU has released a new database compiling the #economic impacts of #COVID-19 on economic activity in #China. https://www.card.iastate.edu/china/covid-19/ (English version) https://www.card.iastate.edu/china-cn/covid-19/ (Chinese version)
1496,2020-04-29 23:56:20+00:00,"FREE Webinar: ""COVID and Beyond: How ACOs can utilize Remote Patient Monitoring and Telehealth to Succeed"" #ACO #ACOs #telehealth #telemedicine ( 4/30 | 1pm EST ) https://attendee.gotowebinar.com/register/3244932998343288848"
1497,2020-04-29 23:56:20+00:00,Hung out with 2 of my covid smart buddies today. I MAYy hqve!! Had 3 much wineee todayee?!?&amp;;:*
1498,2020-04-29 23:56:20+00:00,When Will COVID-19 End? Data-Driven Estimation of End Dates (updated on April 29) 
1499,2020-04-29 23:56:20+00:00,"“Like Fauci, he has a calm and cerebral approach that puts people at ease in a moment of crisis. Both colleagues and constituents look to Mark to guide them through complex issues surrounding covid-19.”"
1500,2020-04-29 23:56:20+00:00,COVID is scoffing at us and this tweet 
1501,2020-04-29 23:56:20+00:00,"I think that this is why we have the big stink about covid, and the non-discussion in the news about Biden, and successful trials of hcq amongst others. "
1502,2020-04-29 23:56:20+00:00,Desinfectante Contra COVID-19 http://networksimple.net/desinfectante-contra-coronavirus/ vía @https://twitter.com/OdontoLinea
1503,2020-04-29 23:56:20+00:00,What No One Tells You About Having COVID-19 
1504,2020-04-29 23:56:20+00:00,Donald Trump can not be trusted to give information concerning Covid-19 health related issues. He has proven that.
1505,2020-04-29 23:56:19+00:00,"Señor gobernador del Edo. Mex. y usted que opina de sus servidores públicos, una familia humilde trabajando todos, porque no hay trabajo en tiempos de covid mientras está gente se para a estirar la mano extorsionando por ""obstruir la vía pública"" que es la puerta de mi casa."
1506,2020-04-29 23:56:19+00:00,Think COVID-19 Is dropping your property value? 
1507,2020-04-29 23:56:19+00:00,why is @dougduce not opening up Arizona? my governor (a republican!) just extended our stay at home order another 2 weeks! We've had 300 deaths supposedly covid or covid adjacent. We have more than 7 Million people. minuscule risk to most people! #OPENARIZONANOW
1508,2020-04-29 23:56:19+00:00,"Nossa cidade tem hoje 346 casos confirmados do novo coronavírus (COVID-19). São ao todo 130 pessoas curadas, 140 em quarentena em suas residências e 52 hospitalizadas e infelizmente temos 24 óbitos. #NiteróiFicaEmCasa #covid19brasil Saiba mais: https://bit.ly/3f3ef2P"
1509,2020-04-29 23:56:19+00:00,"El problema es que no saben tratar al covid-19. Están dejando morir a la gente, con el Pootocolo de la OMS."
1510,2020-04-29 23:56:18+00:00,"It seems today is the day people have shifted from saying new normal / COVID-19 etc... to ""our current situation."" It's not a codeword, we don't have to beat around the bush."
1511,2020-04-29 23:56:18+00:00,"1/ First, they are actually inconsistent in how they compute the death rate which leads them to the wrong conclusion. If you listen carefully, you will see that when computing the death rate from COVID they divide the number of deaths by the number of people in the population."
1512,2020-04-29 23:56:18+00:00,3 na yung gumaling sa Covid-19 dito sa Zambales omg!!!!! THANK YOU PAPA GOD! NAPAKABUTI MO PO TALAGAAAAA 
1513,2020-04-29 23:56:17+00:00,This family is proving their investment in generational wealth and entrepreneurship. My mother’s side set up an insurance program for all the family members that are out of work due to COVID. This is very impressive to me.
1514,2020-04-29 23:56:17+00:00,confirmado o primeiro caso de covid aqui em guajará 
1515,2020-04-29 23:56:17+00:00,How accurate is US COVID-19 death count? Some experts say off by 'tens of thousands' - ABC News https://abcnews.go.com/Health/accurate-us-coronavirus-death-count-experts-off-tens/story?id=70385359 (via @ABC)
1516,2020-04-29 23:56:17+00:00,"2) ""COVID-19, Conspiracy Theories, and 5G Networks"" "
1517,2020-04-29 23:56:17+00:00,"Totally bizarre interview on #BBCHARDtalk where Chinese ambassador first denies that #COVID originated in China then insists the controversial wet markets have been banned. If COVID didn’t originate there, why ban them "
1518,2020-04-29 23:56:17+00:00,Aren’t all the NW tas ones Ruby Princess?
1519,2020-04-29 23:56:17+00:00,""" Nene"" yo que vos le Regalo Una Libretita & Birome ; Pues viene larga la Cuarentena , Darling ! @Juan_Parodi Hacete una Encuesta a ver q Sale! Abrazo, me haces ReiR ! #QuedateEnCasa #Argentina #COVID__19"
1520,2020-04-29 23:56:17+00:00,"Don’t believe the twisted BBC clickbait headline, and read the financial statement. Best Q1 and €1.8B cash increase, despite COVID."
1521,2020-04-29 23:56:17+00:00,"Antibody tests are not reliable, you can’t extrapolate data for the entire USA based on non random unreliable tests, flu season is over 9 months not 4 months, if more of the population had it previously then those deaths were not documented as covid-19 and we are way over 50,000"
1522,2020-04-29 23:56:16+00:00,#coronavirus #coronavirusEspana #Covid_19 Casos chock niños.
1523,2020-04-29 23:56:16+00:00,Muy bueno. Sabemos que nuestro presidente está pendiente de la salud y combatiendo duro al covid-19.
1524,2020-04-29 23:56:16+00:00,"Nem os imbecis tem o devido cuidado. E segurança do presidente que estava com covid-19, tem notícias dele?? "
1525,2020-04-29 23:56:16+00:00,"It's sad! Because it's true. Looking in the obituaries this morning an elderly lady 94, died from covid-19. THAT IS THE FIRST ONE I SEEN THAT HAS TIES TO THIS TOWN"
1526,2020-04-29 23:56:16+00:00,"Lo liberaron ayer.. hoy salió a robar y lo agarraron, su respuesta ""que me importa me liberaron ayer por covid"" PEGALE UN TIRO"
1527,2020-04-29 23:56:15+00:00,Pobre el que lo recibe. Yo me quedo con el COVID
1528,2020-04-29 23:56:15+00:00,Mayor Adler said this plan will help with contact tracing should someone who ate at the restaurant later test positive for COVID-19. 
1529,2020-04-29 23:56:15+00:00,"Another reason why I can't sleep apart from the covid issue is that the last photo i have of my dad is when he was on his death bed, i think a lot about him lately and what occurred during his funeral... Guys angikho ryt "
1530,2020-04-29 23:56:15+00:00,Est ce que notre systeme de sante chagera en post covid ???
1531,2020-04-29 23:56:15+00:00,"Pero por suerte no tiene covid, digamos todo"
1532,2020-04-29 23:56:14+00:00,"I've seen this virus http://before.It only infects http://pigs.It's already on the news,It isn't SARS or COVID-19."
1533,2020-04-29 23:56:14+00:00,Trump working on “ protecting companies and corporations from legal liability for workers who contract COVID-19 on the job.” Companies aren’t obligated to protect their workers. Mr. Sonny you once told small family -owned dairy farms “ big get bigger and the small go out.”
1534,2020-04-29 23:56:14+00:00,Lübnanda göstericiler orduya ait kontrol noktalarını ateşe veriyor #Covid_19 ekonomileri vurmaya devam ederse bu görüntüleri bir çok ülkede görebiliriz
1535,2020-04-29 23:56:14+00:00,"@realDonaldTrump I got covid a week ago and My wife and I both had to leave our “Essential” jobs, where’s my stimulus check G ya boy starving here"
1536,2020-04-29 23:56:13+00:00,Con cualquiera menos con team covid 19 
