date,text,state,query_term
2020-04-16 18:13:36+00:00,Governor Cuomo has extended school closures until May 15th. Information is provided here. ,Alabama,school closures
2020-04-03 19:17:47+00:00,Thank you to our AWESOME OA faculty and staff for their outstanding work during this school closure! @OAhornets @OaElem #1,Alabama,school closures
2020-04-21 13:41:06+00:00,Many #thanks to our local @ChickfilA for donating cookies to our #communityfeeding sites this week! Today’s donation went to @les_smcps! They’re delivering to all sites this week so keep an eye out for locations! #schoolclosures #communitymatters – at Leonardtown Elementary School,California,school closures
2020-04-08 11:31:48+00:00,"Staff from @chs_smcps, @BBES_SMCPS @des_smcps and more are helping out at @mbms_smcps! Stop by and see them- today at all sites we have a special surprise for any kids who come! 11:30-12:30 #schoolclosures #feedingthefuture @NoKidHungryMD @MarylandHunger",California,school closures
2020-04-01 15:20:28+00:00,@les_smcps is ready for you! @lpes_smcps @mbms_smcps @gkes_smcps are ready too! Serving meals for kids &lt;18 years old 11:30-12:30 daily! #schoolclosures @MarylandHunger @NoKidHungryMD – at Leonardtown Elementary School,California,school closures
2020-04-08 13:21:23+00:00,"Thanks to the enormous generosity of the .@HartfordFdn, we’re able to purchase WiFi HotSpot Devices for our families w/o internet connection. We’re grateful to be able to provide this new essential during this period of school closure. #StaySafeStayHome #WindsorLocksPublicSchools",Connecticut,school closures
2020-04-28 02:38:47+00:00,"Interesting! @ChelsenVicari covered a few of these seminary closures. I do disagree that if liberal Baptist seminaries keep closing, liberal Baptists are likely to start taking up spots at Southern Baptist seminaries. They’re more likely to teach in schools of other traditions.",DC,school closures
2020-04-28 01:45:26+00:00,My years in the classroom were filled with trackers to understand the skills and content that student mastered. This data is critical to inform what to teach next and even more important during school closures. #dataliteracy,DC,school closures
2020-04-27 13:06:11+00:00,"Under the guidance of Mayor Bowser, Early Childhood Academy will end the 2019-2020 School Year on Friday, May 29, 2020. Distance learning will continue until our May 29th school closure. @Early Childhood Academy PCS https://www.instagram.com/p/B_fEEzqnzQr/?igshid=95uzmg6hfpfm",DC,school closures
2020-04-26 21:23:49+00:00,Parents agree — #nowaivers to IDEA needed b/c it is flexible enough to handle school closures. Parents don’t want to waive their rights goodbye! Please share this parent survey so we can learn more about how school districts is doing ,DC,school closures
2020-04-25 16:38:41+00:00,"As I sit here reviewing my outlines, I realize that law school isnt designed for those who need answers or closure. Whatever happened to International Shoe? Did the Rays ever get that home the Eurice Bros promised them? How is it that I know more corporations than people from DE?",DC,school closures
2020-04-24 20:40:42+00:00,"Let’s hear it for the AMAZING CCPS FNS Staff distributing meals for children at our 11 sites during the school closure!! As of this week we have distributed over 156,000 meals to the children of Charles County! #operationfeedthekids #FeedingtheFuture",DC,school closures
2020-04-20 19:35:31+00:00,"Greetings, in response to the recent job and school closures due to the COVID-19 outbreak sponsorafam is back again looking to sponsor families in need with an all expense paid trip to the grocery store. If you know… https://www.instagram.com/p/B_NvEGzB_OC/?igshid=d4r656eyb8x",DC,school closures
2020-04-17 01:09:19+00:00,Poignant article from the @nytimes Editorial Board about the impact of school closures and what it will take for us to counter the resulting multi-year learning loss. ,DC,school closures
2020-04-15 16:32:37+00:00,"School closures, and as a result distance learning plans, have been extended to May 15th as the District continues to combat COVID-19. ",DC,school closures
2020-04-15 01:20:03+00:00,"There is no partisanship. The governors and mayors issued all these stay-at-home orders, school closures and business restrictions so it will be up to them to lift them. Not sure what you think the president can do here? Please, explain.",DC,school closures
2020-04-14 23:51:35+00:00,Survey on gendered impact of school closures ,DC,school closures
2020-04-10 21:59:48+00:00,"Our amazing CCPS FNS Staff has served over 102,000 meals to the children of Charles County in the last four weeks during school closures. They truly are #FeedingTheFuture #operationfeedthekids",DC,school closures
2020-04-10 20:52:40+00:00,flipgrid Has been an amazing add-on to my classroom since the school closure. Do you see that engagement number?? #apbiology #pgcps @Maryland https://www.instagram.com/p/B-0H8Pzhzta/?igshid=1pp84vhnt0tyi,DC,school closures
2020-04-10 20:00:01+00:00,"This isn’t accurate. People were social distancing well before formal lockdown orders. Here in DC many of us started substantially changing our lives in early March. But even aside from that, formal closures in New York (eg schools) started on March 18, 24 days ago. ",DC,school closures
2020-04-10 12:17:13+00:00,"The cars lined up with families for food and prayer. @reidtempleame and @pgcps fed over 500 families in need! #reidtempleame Reid Temple, Let’s go.. #socialimpact #foodinsecurity #covi̇d19 #schoolclosures #communitypartners #feedingfamilies #inspiration #churches #gooddeeds",DC,school closures
2020-04-08 23:25:43+00:00,"Good to see the proactive stance and the reality that it will take months to ramp up quality, equitable online learning in #Maryland. #onlinelearning #coronavirus #schoolclosures ",DC,school closures
2020-04-08 10:42:28+00:00,Okay CCPS FNS.... Let’s do this! #FeedingTheFuture during school closures! ,DC,school closures
2020-04-07 10:45:50+00:00,Check out this animation showing the worldwide progression of school closures. The speed and scope are stunning.. Any more questions about why it’s been a rough transition? ,DC,school closures
2020-04-03 18:14:32+00:00,".@PoPville there are many DCPS students and families who are affected by school closures in a variety of ways. I encourage our DC community to consider helping if they can, either CHEC or another school in your ward. Thank you. ",DC,school closures
2020-04-02 17:59:47+00:00,Thanks! #WashYourPaws #WeareFC I got it from @theShopForward and @mrBobbyBones The money goes to support at-risk and underserved youth who need more assistance due to school closures during #COVIDー19,DC,school closures
2020-04-20 15:18:55+00:00,"Tomorrow, @casecec is holding a webinar on special education during school closures; to register: https://register.gotowebinar.com/register/1982390184362996491",DC,school closures
2020-04-17 17:04:26+00:00,Here’s the school closure tweet about school from @dcpublicschools,DC,school closures
2020-04-17 11:20:22+00:00,"And yes, disparities will worsen, gaps will widen. It will take all of us devising a plan to ensure we can mitigate the learning loss happening due to school closures.",DC,school closures
2020-04-16 18:54:27+00:00,Many governors are announcing that kids will be going back to school on May 15th. Do you think kids will be going back this year? #school #schoolclosures,DC,school closures
2020-04-12 03:06:44+00:00,"Bilingual facilitators, nonprofits in Anne Arundel reach non-English speakers during school closure for coronavirus pandemic ",DC,school closures
2020-04-11 00:42:02+00:00,"Not that weekends have any real meaning anymore, but we have made it through four workweeks since the advent of mass school closures! ",DC,school closures
2020-04-01 04:39:30+00:00,@ProvidenceFCPS @fcpsnews @FCPSSupt will you mandate that teachers will have the official spring break off? Free of carrying the failures of @GovernorVA hair trigger closure of schools before allowing them the time to put the distance learning program together? They deserve it.,DC,school closures
2020-04-20 20:28:42+00:00,Social media graphics for the extended school closure are here for your use. Check out these and others in the social media library on our site! ,Delaware,school closures
2020-04-21 21:47:16+00:00,If only the President had demanded school closures.... My kids would’ve been back in class today (even tho it’s April vacation)...,Massachusetts,school closures
2020-04-07 07:56:56+00:00, School closures don’t work. ↺ #dd_rt #dd_CvsLunacy #dd_uk #dd_Cvs #dd_CvsShutdown,Massachusetts,school closures
2020-04-25 01:26:28+00:00,Our two both follow school closures.,Mississippi,school closures
2020-04-14 13:06:07+00:00,"“Millions of Americans are faced with newfound stressors related to teleworking, school closures, unemployment, investment insecurity and health care uncertainty.” Protect your mental health, and let yourself rest. https://www.nerdwallet.com/blog/finance/free-ways-to-protect-your-mental-health/ #TeamDCS #SchoolCounselorsConnect",Mississippi,school closures
2020-04-09 02:20:02+00:00,"It’s accurate. Despite Trump’s social distancing guidelines, @tatereeves said he will let MS know by Tuesday (the 14th) if school closures will be extended past the 17th. Seems everyone knows that it should last longer, but for some reason, Tate still has to think about it!!",Mississippi,school closures
2020-04-25 22:14:10+00:00,Handsome smile from a student texting me this afternoon Thank you to parents who encourage teacher/student relationships to continue through school closure! #TrustyHuskies #CPSBest,Missouri,school closures
2020-04-13 15:23:45+00:00,Updated sites serving meals during school closure ,Missouri,school closures
2020-04-09 01:00:34+00:00,This girlie had a lot of fun with the scavenger hunt her Science teacher @mrs_jenpayne prepared for the 6th graders. I had never seen her run so fast! @gentry_middle #CPSBest #schoolclosures ,Missouri,school closures
2020-04-05 19:54:26+00:00,"Since our extended closure began on 3/18, JC Schools has served breakfast &amp; lunch to 5,808 students through our Mission Nutrition program. It is wonderful to see our students’ faces and know we are providing support for families during these uncertain times.#JCStrongerTogether",Missouri,school closures
2020-04-03 09:40:19+00:00,"I do hope schools consider having class, even if it it just for a few days, just to close out the year. I think students and teachers would appreciate having a chance to see each other and to get closure—especially seniors. No academic work is needed.",Missouri,school closures
2020-04-24 16:19:11+00:00," seeing the various ways @nearpod is being used to support #distancelearning. However, this might be my new favorite example! #schoolclosures #remotelearning #covidEDU #nearpod",New York,school closures
2020-04-24 02:30:14+00:00,"22 MILLION student joins in the past 54 days! ...+ 160 MILLION assessment responses! #nearpod SO thankful for ALL the Ts out there doing EVERYTHING possible to engage, support + educate your Ss during #schoolclosures!You the real MVPs! #remotelearning #distancelearning",New York,school closures
2020-04-16 22:21:29+00:00,“30 million children rely on school for food and with school closures.....so we’re going to read them books” ,New York,school closures
2020-04-11 19:01:20+00:00,"Hearing Di Blasio announce the closure of schools for the remainder of this academic year is crippling to those graduating. As a college and career counselor, I thrive on the excitement of my seniors.",New York,school closures
2020-04-11 16:12:15+00:00,Anyone holding up the NY government as a bastion of stability during this crisis can look no further than this exchange to see that our leadership is failing across the board. This is one hour after De Blasio announced school closures. ,New York,school closures
2020-04-10 18:40:03+00:00,#linked @nokidhungry Join #amydelsonjewelry and members of the #jewelry community to help ensure that our neighbors and kids have access to food despite school closures. . Shop lots of new pieces added to my site.… https://www.instagram.com/p/B-z4xQ3llqG/?igshid=1fhhmrytztxa,New York,school closures
2020-04-10 17:48:05+00:00,Follow #REACH @hgse for new content highlighting actions to foster #welcoming communities &amp; quality #education during #school closures caused by #Covid19 with lessons from #refugee education and #EiE |,New York,school closures
2020-04-10 15:41:27+00:00,Let him do it at a time that’s healthy for everybody not to just rush production. Also make sure the schools are stocked with gloves and masks and sanitizer. We were promised this before all the closures and never got it.,New York,school closures
2020-04-10 10:19:27+00:00,"Podcast 58. How Covid-19 is Impacting the School/Office Supplies Category: Leen Nsouli, @npdgroup https://anchor.fm/ecrmpodcast/episodes/58--How-Covid-19-is-Impacting-the-SchoolOffice-Supplies-Category-Leen-Nsouli--NPD-ecjl0f #COVID19 #coronavirus #schoolclosures #Workathome #StayAtHomeOrder #shopping #ecrmrangeme",New York,school closures
2020-04-09 14:43:13+00:00,Over half a billion meals at school have been missed due to school closures ,New York,school closures
2020-04-08 13:57:49+00:00,“NYC as a whole was late in social measures. Any after-action review of the pandemic in NYC will focus on that issue. It has become the major issue.” Including w/ school closures. Where's educator #COVID19 + numbers @DOEChancellor @NYCMayor @UFT? Deaths?,New York,school closures
2020-04-07 18:15:16+00:00,NYC community leaders want a taskforce to address disparities widened by coronavirus school closures ,New York,school closures
2020-04-07 17:15:05+00:00,"Bloomfield Pulse: From Bloomfield Public School District, New Jersey Bloomfield School District will be extending the school closure until further notice. The Bloomfield School District plans to maintain our… https://www.instagram.com/p/B-sAqLED9v0/?igshid=miha3aktzha4",New York,school closures
2020-04-05 14:42:08+00:00,The school closures are excruciating for kids with special needs like autism who thrive on routine and need 1:1 social interaction. Zoom at least provides a moderate replica of that. Taking it away now just when these kids have finally adjusted ( a little) is nonsensical,New York,school closures
2020-04-04 19:57:40+00:00,I’m glad the art teacher from TikTok is doing well during the school closures :) ,New York,school closures
2020-04-04 12:10:37+00:00,"#StayingAtHome and #SocialDistancing are not easy for any of us but they can be extra hard for teenagers.Let’s be there for them, let’s listen to them and let’s help them cope with these uncertain times. #MentalHealthMatters #cyberbullying #EndViolence #schoolclosures #COVID19",New York,school closures
2020-04-03 16:42:23+00:00,Millions of vulnerable children are losing the school meals they depend on. @NoKidHungry is working to help feed them — during school closures and all year long. Please consider donating today. https://bit.ly/3aGbrGl,New York,school closures
2020-04-03 16:30:19+00:00,"*NEW* SCHOOL CLOSURE EXTENDED: In accordance with state and federal guidelines, Mount Saint Michael Academy’s campus will remain closed until April 30th. Learn more at http://www.mtstmichael.org",New York,school closures
2020-04-03 14:26:52+00:00,We’re so grateful for the amazing people still working tirelessly to make sure kids are getting the meals they need despite #COVID19 school closures. That’s why we’re/I'm joining @NoKidHungry THIS FRIDAY from 4:30-5:30 pm ET to #ThankAHungerHero. Join in:,New York,school closures
2020-04-01 10:47:50+00:00,"NYC : I know there’s a lot to feel down about now: colleagues, long hours, cancelled Spring Break -but I don’t have to hold off on breaks, and I put on regular pants today-so that’s a@win, right? #wins #schoolclosures #remotelearning",New York,school closures
2020-04-21 17:59:44+00:00,"I have no settled view and am not defending this, but NYC numbers are still quite bad and no one has any faith in schools ability to be nimble here. They could barely even try to clean the schools where known infections occurred, prior to the closure",New York,school closures
2020-04-14 02:53:35+00:00,@TeachersCollege Professor of Sociology &amp; Education Aaron Pallas on the dispute between Cuomo and De Blasio over the #NYC school closure. ,New York,school closures
2020-04-14 02:09:13+00:00,As we are seeing with the school closures. So many kids with no Pcs or WiFi access,New York,school closures
2020-04-12 20:08:00+00:00,"@NYGovCuomo as usual going for the power grab, he didn’t coordinate with anyone when he said schools would be open during spring break, now he feels undermined by @NYCMayor Deblasio for announcing school closures before him. Schools should remain close for everyone’s safety",New York,school closures
2020-04-12 00:35:54+00:00,How broadband inequality complicates COVID-19 school closures in many areas ,New York,school closures
2020-04-11 20:16:47+00:00,"Perhaps, it's the dash of hyperbole that your boss adds to his warnings that's the problem here and his terrible timing. Why do you need to communicate a major school closure on a holiday weekend? To pre-empt Cuomo so you can have some ""ink"" and airtime before Monday's presser?",New York,school closures
2020-04-11 16:23:50+00:00,#TeacherQuestions for @NYCMayor @DOEChancellor Cont. @News12BX How will schools that operate summer orientations for new or all teachers (primarily charters that require teachers to come in anywhere from 1-3 weeks early) be affected by building closures?,New York,school closures
2020-04-11 16:16:28+00:00,"#TeacherQuestions for @NYCMayor @DOEChancellor Cont. @News12BX In regards to year to year teachers, (especially in charter schools all over the city), how are contracts going to be offered? How do teachers/schools interview for open jobs w/ closures/stay at homes in place?",New York,school closures
2020-04-11 16:14:08+00:00,"@NYCMayor @NYGovCuomo You are the problem with NYC politics. You both want to be the “big fish” “Paul Revere” with important breaking updates. The last 2hrs, 2 different messages regarding school closure. Absurd! We’re in this together, remember?",New York,school closures
2020-04-07 21:21:58+00:00,New video! How to get your crush to like you when school reopens! https://youtu.be/HE5vQrknmFc #Quarantine #schoolclosures #School2020,New York,school closures
2020-04-09 14:32:06+00:00,JUST IN: Governor Wolf extends school closure for remainder of school year.,Pennsylvania,school closures
2020-04-05 12:46:20+00:00,"In the last 3 years of teaching, I have been through a 10-day walkout for funding, lots of flooding and tornadoes, and now a closure of schools for distance learning due to a pandemic.",Pennsylvania,school closures
2020-04-23 12:46:33+00:00,The primary method for limiting infections in a pandemic is school closures...it’s literally the first step in the pandemic response playbook and has been shown to reduce infections by almost 90% according to the models ,Rhode Island,school closures
2020-04-21 15:17:15+00:00,"Cannot be emphasized enough: Existing mental illness among adolescents may be exacerbated by the pandemic, and with school closures, they will not have the same access to key mental health services @NYSomh @HealthNYGov",Rhode Island,school closures
2020-04-13 13:03:10+00:00,I have the cover image on today’s edition of the Saratogian for a story about the impacts of school closures on students. Here’s the story behind that image: http://www.johnbulmerimages.com/2020/04/time-capsule-covid-19-saratogian.html,Rhode Island,school closures
2020-04-03 21:23:31+00:00,"I’ll be the first to admit it, I watched this video made remotely by PVM High School Staff with tears in my eyes. Everyone @CentralSquareSD loves and misses our students!!! When the closure ends we need an official Redhawk Day of collective celebration ",Rhode Island,school closures
2020-04-03 01:05:02+00:00,"No, I’m the one that needs to thank you. I see you in the high school constantly sanitizing everything during this closure. You @Doloresbrown73 and all the custodians are our heroes!!! When this is over, I’m treating all of our custodians to a night of endless pizza and Karaoke!",Rhode Island,school closures
2020-04-02 14:33:43+00:00,"@NYGovCuomo worked with govs in the tristate area to coordinate a shut down trying to ensure xstate contam I imagine slow school closure had many factors, the belief that kids are less likely to be infected vs their welfare ie. Childcare meals for some kids school is a safe haven",Rhode Island,school closures
2020-04-01 16:29:08+00:00,6-12 are using Teams. The majority had not been using it prior to our school closure so there was definitely a learning curve. However we were lucky to have 1 day that we were able to do a quick PD session and are providing online support to assist teachers on a day-to-day basis,Rhode Island,school closures
2020-04-22 15:56:13+00:00,“Our children will survive this and we all are going to come out stronger” @Molly_Spearman stated during live press conference on school closures. #Allinforkids #AloneTogether #SCStrong,South Carolina,school closures
2020-04-03 20:23:21+00:00,This is a reminder that all school facilities are closed including ALL athletic facilities and parking lots This closure has been put in place by the Superintendent of Schools in order to comply with restrictions set forth by the Governor of Ky. The tennis court area is not ours.,Utah,school closures
2020-04-28 02:38:47+00:00,"Interesting! @ChelsenVicari covered a few of these seminary closures. I do disagree that if liberal Baptist seminaries keep closing, liberal Baptists are likely to start taking up spots at Southern Baptist seminaries. They’re more likely to teach in schools of other traditions.",Washington,school closures
2020-04-28 01:45:26+00:00,My years in the classroom were filled with trackers to understand the skills and content that student mastered. This data is critical to inform what to teach next and even more important during school closures. #dataliteracy,Washington,school closures
2020-04-27 13:06:11+00:00,"Under the guidance of Mayor Bowser, Early Childhood Academy will end the 2019-2020 School Year on Friday, May 29, 2020. Distance learning will continue until our May 29th school closure. @Early Childhood Academy PCS https://www.instagram.com/p/B_fEEzqnzQr/?igshid=95uzmg6hfpfm",Washington,school closures
2020-04-26 21:23:49+00:00,Parents agree — #nowaivers to IDEA needed b/c it is flexible enough to handle school closures. Parents don’t want to waive their rights goodbye! Please share this parent survey so we can learn more about how school districts is doing ,Washington,school closures
2020-04-25 19:08:28+00:00,Join me and @PeterMDeWitt on Monday on Corwin’s Facebook page. We’ll be chatting about what’s most important for student learning during school closures. #edchat #educoach Join at this link at 2 pm ET: http://Facebook.com/CorwinPress,Washington,school closures
2020-04-25 16:38:41+00:00,"As I sit here reviewing my outlines, I realize that law school isnt designed for those who need answers or closure. Whatever happened to International Shoe? Did the Rays ever get that home the Eurice Bros promised them? How is it that I know more corporations than people from DE?",Washington,school closures
2020-04-24 20:40:42+00:00,"Let’s hear it for the AMAZING CCPS FNS Staff distributing meals for children at our 11 sites during the school closure!! As of this week we have distributed over 156,000 meals to the children of Charles County! #operationfeedthekids #FeedingtheFuture",Washington,school closures
2020-04-20 19:35:31+00:00,"Greetings, in response to the recent job and school closures due to the COVID-19 outbreak sponsorafam is back again looking to sponsor families in need with an all expense paid trip to the grocery store. If you know… https://www.instagram.com/p/B_NvEGzB_OC/?igshid=d4r656eyb8x",Washington,school closures
2020-04-17 01:09:19+00:00,Poignant article from the @nytimes Editorial Board about the impact of school closures and what it will take for us to counter the resulting multi-year learning loss. ,Washington,school closures
2020-04-15 16:32:37+00:00,"School closures, and as a result distance learning plans, have been extended to May 15th as the District continues to combat COVID-19. ",Washington,school closures
2020-04-15 01:20:03+00:00,"There is no partisanship. The governors and mayors issued all these stay-at-home orders, school closures and business restrictions so it will be up to them to lift them. Not sure what you think the president can do here? Please, explain.",Washington,school closures
2020-04-14 23:51:35+00:00,Survey on gendered impact of school closures ,Washington,school closures
2020-04-10 21:59:48+00:00,"Our amazing CCPS FNS Staff has served over 102,000 meals to the children of Charles County in the last four weeks during school closures. They truly are #FeedingTheFuture #operationfeedthekids",Washington,school closures
2020-04-10 20:00:01+00:00,"This isn’t accurate. People were social distancing well before formal lockdown orders. Here in DC many of us started substantially changing our lives in early March. But even aside from that, formal closures in New York (eg schools) started on March 18, 24 days ago. ",Washington,school closures
2020-04-10 12:17:13+00:00,"The cars lined up with families for food and prayer. @reidtempleame and @pgcps fed over 500 families in need! #reidtempleame Reid Temple, Let’s go.. #socialimpact #foodinsecurity #covi̇d19 #schoolclosures #communitypartners #feedingfamilies #inspiration #churches #gooddeeds",Washington,school closures
