date,text,state,query_term
2020-05-05 19:48:42+00:00,"Looking for: Collaborative ideas from those who are impacted most by school closures: parents/caregivers, students and educators. Help us imagine how we can reshape schools and learning post-COVID.",Alabama,school closures
2020-05-02 13:16:37+00:00,"Hong Kong has given the world a lesson in how to effectively curb COVID-19. With a population of 7.5M, it has reported just 4 deaths. HK put in swift surveillance, quarantine, social-distancing measures like the use of face masks & school closures, to cut coronavirus transmission",Alabama,school closures
2020-05-05 22:17:53+00:00,"I've had a few people DM me and ask about the donation that has been returned (in the form of credits) from the SeaLife Center project that I had to cancel due to the closure of schools. If you need help understanding how to use your credits, please DM me and I will try to help.",Alaska,school closures
2020-05-05 17:32:18+00:00,"My children as well. Their current, before closures, grades will stay and if they turn HW in, their grades will only get better. I try to explain best I can but I didn't go to school for that. Usually ends up in a 20 minute explanation for 1 question.",Alaska,school closures
2020-05-05 01:49:24+00:00,"A5: Standardized assessment for math, reading, & science was cancelled in Iowa this year due to school closure. #ELLChat",Alaska,school closures
2020-05-05 01:40:08+00:00,A4: Instruction since school closure has only been focused on essential standards. #ELLChat,Alaska,school closures
2020-05-05 01:13:15+00:00,"A2: My district is only giving grades at high school (9-12) for required learning. Their are different options, but the grade can't be lower than what it was before school closure. #ELLChat",Alaska,school closures
2020-05-03 00:25:09+00:00,For Ts - What's one thing you've learned about yourself as a teacher during school closure? For Ss - What do you wish your T knew about you (esp now that school's closed)? #ELLChat,Alaska,school closures
2020-05-02 14:58:21+00:00,"Happy School Lunch Hero Day! Thank you to EVERYONE who keeps our children fed during the school year, and during this school closure. Your efforts are truly heroic! #sepolk @SEPFoodService",Alaska,school closures
2020-05-02 13:43:29+00:00,Taking a challenge (no family events due to school closure) and finding an opportunity (using Facebook Live to engage families - at their convenience) @ChapaTISD #MADpd https://www.youtube.com/watch?v=DkTygid9gRI&amp;feature=youtu.be,Alaska,school closures
2020-05-01 17:24:32+00:00,"Thank You Southeast Polk Principals! We always appreciate you but now more than ever. Thanks for everything, especially during this time of school closure! #sepolk",Alaska,school closures
2020-05-04 20:22:00+00:00,Coronavirus school closures may cause 'learning gaps' ,Arizona,school closures
2020-05-04 16:13:40+00:00,"Sorry @alicecooper, looks like school isn't out forever. @Supt_Hoffman announced that plans are underway to reopen schools in the fall, ending statewide closures that started in March. ",Arizona,school closures
2020-05-02 07:43:24+00:00,I feel terrible for all the graduating spring sport high school students who missed out on having their final performances evaluated by college teams because of the school closures.,Arizona,school closures
2020-05-01 14:26:02+00:00,Literacy is about more than reading books. Use fun activities like this to help your child get creative with words! Find more fun ways to encourage learning at home at http://TodayInAZ.org. #TodayInAZ #COVID19 #Homeschooling #SchoolClosures ,Arizona,school closures
2020-05-01 13:27:28+00:00,Safely back to school after coronavirus closures https://mck.co/2xnaS5U via @McKinsey,Arizona,school closures
2020-05-05 21:27:07+00:00,Did you catch last week's special episode of @NBC's Parks and Recreation? Character Donna said some wise words about the work of teachers during school closures.. Happy #TeacherAppreciationDay! #teacherappreciationweek #quaranteaching,California,school closures
2020-05-05 20:03:18+00:00,As a essential worker I would like to know if there are local to Lawndale licensed daycare centers that are going to be able to help families like mine. I am a nurse and need childcare for my son who can’t go to school because of closures. What reliable resources are available?,California,school closures
2020-05-05 18:58:57+00:00,@Jo_Frost So cool to see you crop up in my notifications - thanks! Can I talk you into a 10-minute zoom with HS students who are raising younger sibs during school closure?,California,school closures
2020-05-05 13:59:05+00:00,@FredTJoseph $EC530 I was a Coach and mentor at Tafoya Elementary. Because of school closures the company has shut down. I just lost a 2nd job doing ag work. I'm also extremely behind on vet bills for my pitbull suffering from skin cancer. #RENTRELIEF,California,school closures
2020-05-04 20:01:20+00:00,The key to registering new and returning students amid #COVID19 closures? Designing your online enrollment process around your #K12 families’ needs &gt;&gt; https://bit.ly/2SreyL2,California,school closures
2020-05-04 17:49:14+00:00,"Over the past 10 years we have been hearing that schools were the cause of inequality- Now school closures are the cause of inequality. You can’t have it both ways. U see inequality in everything. U see racism in everything, except where it really exists- racist woke ideology.",California,school closures
2020-05-04 17:36:17+00:00,Big Education Ape: Joint Statement of Education and Civil Rights Organizations Concerning Equitable Education During the COVID-19 Pandemic School Closures | Schott Foundation for Public Education - https://bigeducationape.blogspot.com/2020/05/joint-statement-of-education-and-civil.html,California,school closures
2020-05-03 17:00:44+00:00,We must take advantage of this closure to take our kids of the government schools for the sake of our kids. https://twitter.com/conceptualjames/status/1256974545241673734?s=21,California,school closures
2020-05-03 00:19:05+00:00,"I’ve been giving my classes weekly book talks, and school closures have not stopped me. Here was this week’s book: The Lightness of Hands by @jeffgarvinbooks. I am so excited for them to read Ellie’s story!",California,school closures
2020-05-02 15:24:09+00:00,And the closures of hospitals b/c they can't afford to be open anymore. And the schools.,California,school closures
2020-05-02 15:09:37+00:00,"No lockdowns, no forced business closures, schools stayed open, same pattern as the rest. ",California,school closures
2020-05-01 22:11:04+00:00,50 Resources Schools &amp; Teachers Can Use During COVID-19 Closures http://dlvr.it/RVrYwF #CollegeEducation #FamilyHome,California,school closures
2020-05-01 18:02:58+00:00,"School closures have made it hard for essential workers to care for their children still going to work. California has a new website to help essential workers find safe, reliable child care during the coronavirus pandemic. More information here: ",California,school closures
2020-05-01 17:27:48+00:00,.@ASMGabriel please vote YES on #SB493 to protect campus sexual assault survivors. #COVID closures and federal #TitleIX changes have left schools confused and students at risk. Please give colleges the guidance they need and students the safety they deserve @equalrightsadv,California,school closures
2020-05-01 16:13:25+00:00,"TODAY is #SchoolLunchHeroDay! “No need for a cape when you have an apron ” MUSD Nutrition has 100 staff on the front line, serving lunch &amp; breakfast to students at 24 schools in 4 cities. In the 6 weeks of #DistanceLearning &amp; campus closures, our team served 165,922 meals ",California,school closures
2020-05-01 16:10:12+00:00,Case Study: @vedamoelearning is a GG4L #EdTEch partner vendor featured in the Catalyst Catalog and one of many services that members can choose to try with a GG4L #OnDemandGrant. Discover how they helped @sofiauniversity deliver their courses online,California,school closures
2020-05-01 15:51:32+00:00,"Unlike many Ed companies who are offering free accounts during the school closures, Quindew—a dynamic and fun reading comprehension platform—is always free for teachers and students! Students get it all! Every feature, everyday. Get started today at http://Quindew.com.",California,school closures
2020-05-01 15:35:40+00:00,Researchers say COVID-19 school closures could further summer learning loss https://thelensnola.org/2020/05/01/researchers-say-covid-19-school-closures-could-further-summer-learning-loss/ #press #feedly,California,school closures
2020-05-01 12:07:34+00:00,"With no last day of school, kids will need help with closure — here's what experts say parents should do http://dlvr.it/RVpwtn #smallbusiness",California,school closures
2020-05-01 05:10:07+00:00,"Over 39,000 students reached in 5 weeks of @CAStateParks @portsprogram’s respond to #COVID__19 &amp; school closures - #HomeLearning Programs. Check out our new programs for next week, including some BRAND NEW @CAStateParks ! Thank you for continuing to share these posts!",California,school closures
2020-05-05 21:48:22+00:00,How many schools will be underfunded (this higher taxes to an already significantly higher unemployed population) because of closure.,California,school closures
2020-05-05 16:38:29+00:00,$EC530 I was a Coach and mentor at Tafoya Elementary. Because of school closures the company has shut down. I just lost a 2nd job doing ag work. I'm also extremely behind on vet bills for my pitbull suffering from skin cancer. #RENTRELIEF #GivingTuesdayNow,California,school closures
2020-05-05 16:30:54+00:00,"Hey #CAteachers, did you miss any of the @CADeptEd's April webinars on #DistanceLearning? The page lists all CDE webinars related to the #Coronavirus (#COVID19), including #schoolclosures, #townhalls and other guidance. https://cde.ca.gov/ls/he/hn/covid19webinars.asp #CAedu #caeducation",California,school closures
2020-05-05 16:12:59+00:00,Hey @JeffreeStar can you help one of your biggest fans out &amp; retweet this? I’m a teacher in California &amp; donations to my @DonorsChoose projects are being doubled right now on a projects to provide my students with resources during school closures! Thanks! ,California,school closures
2020-05-05 01:41:24+00:00,Big Education Ape: Joint Statement of Education and Civil Rights Organizations Concerning Equitable Education During the COVID-19 Pandemic School Closures | Schott Foundation for Public Education - http://bigeducationape.blogspot.com/2020/05/joint-statement-of-education-and-civil.html,California,school closures
2020-05-04 21:10:05+00:00,"Happy #TeacherAppreciationWeek! We celebrate all the #teachers helping spark #STEM learning. We are inspired by your dedication, determination, and resilience in the face of #schoolclosures and the rapid shift to #remotelearning and #teachfromhome strategies.",California,school closures
2020-05-04 18:13:20+00:00,"As coronavirus school closures continue, scores of Tucson children have fallen off the radar | Local news | http://tucson.com - https://tucson.com/news/local/as-coronavirus-school-closures-continue-scores-of-tucson-children-have-fallen-off-the-radar/article_9b962cac-4cd1-5401-a790-2e6e89b50f0b.html#new_tab by @http://twitter.com/danyellekhmara on @tucsonstar",California,school closures
2020-05-04 18:03:08+00:00,Nominate an amazing K-12 teacher! Educators are going above and beyond + holding it down during school closures! Return the favor and spotlight their fabulous work #caedchat #quaranteaching #edchat #distancelearning,California,school closures
2020-05-04 13:50:34+00:00,Time for Kids Launches Free Digital Library for Those Affected Globally by School Closures During the Coronavirus Pandemic ,California,school closures
2020-05-03 16:52:23+00:00,"@GasiaKTVU thank you for taking the time to interview @xilonin our representative @CSBA_Now During this crucial time for CA children it is important the 5,100 elected trustees have a voice in the decisions made by @CADeptEd In it together. #COVID19",California,school closures
2020-05-02 15:20:09+00:00,Please HELP! My city is trying to vote for the appealing of School Closures. They want to put us back into school during this ongoing Pandemic.,California,school closures
2020-05-01 17:27:42+00:00,.@bill_brough please vote YES on #SB493 to protect campus sexual assault survivors. #COVID closures and federal #TitleIX changes have left schools confused and students at risk. Please give colleges the guidance they need and students the safety they deserve @equalrightsadv,California,school closures
2020-05-01 16:29:59+00:00,Check out my classroom on @DonorsChoose! I'd love your help to bring my project to life: Technology needed to support teaching during school closures. ,California,school closures
2020-05-01 14:53:04+00:00,"Never tire of lack of facts or science #snowflakes use. Always a smart mouth, never data or civil discussion. I guess a #MeToo denier doesn't care about objective truth So we don't care we’re hurting our children w #lockdown?",California,school closures
2020-05-05 15:49:21+00:00,,California,school closures
2020-05-04 15:28:52+00:00,Poll: 52% of Parents View Homeschooling More Favorably Since Coronavirus School Closures https://www.breitbart.com/politics/2020/05/04/52-parents-view-homeschooling-more-favorably-coronavirus-school-closures/ via @BreitbartNews,California,school closures
2020-05-02 13:51:04+00:00,$EC530 I was a Coach and mentor at Tafoya Elementary. Because of school closures the company has shut down. I just lost a 2nd job doing ag work. I'm also extremely behind on vet bills for my pitbull suffering from skin cancer. #RENTRELIEF,California,school closures
2020-05-01 19:31:24+00:00,"#learning #Learningathome #schoolclosures #Students #studentsuccess Without classroom distractions and social pressures, some are learning more at home, especially ""shy kids, hyperactive kids, highly creative kids."" https://bit.ly/2YokE2F",California,school closures
2020-05-01 12:26:05+00:00,@POTUS @Local12 @Jim_Jordan @WarrenDavidson @AlexBerenson @Re_OpenAmerica it is time to #ReopenAmerica We can protect #vulnerable without hurting #economy and children Orders without rational or #DueProcess is #tyranny. #reopenohio,California,school closures
2020-05-01 17:27:43+00:00,.@AsmEGarciaAD56 please vote YES on #SB493 to protect campus sexual assault survivors. #COVID closures and federal #TitleIX changes have left schools confused and students at risk. Please give colleges the guidance they need and students the safety they deserve @equalrightsadv,California,school closures
2020-05-01 17:27:41+00:00,.@FrankBigelowCA please vote YES on #SB493 to protect campus sexual assault survivors. #COVID closures and federal #TitleIX changes have left schools confused and students at risk. Please give colleges the guidance they need and students the safety they deserve @equalrightsadv,California,school closures
2020-05-01 17:27:40+00:00,.@iancalderon please vote YES on #SB493 to protect campus sexual assault survivors. #COVID closures and federal #TitleIX changes have left schools confused and students at risk. Please give colleges the guidance they need and students the safety they deserve @equalrightsadv,California,school closures
2020-05-01 17:27:38+00:00,.@AsmBillQuirk please vote YES on #SB493 to protect campus sexual assault survivors. #COVID closures and federal #TitleIX changes have left schools confused and students at risk. Please give colleges the guidance they need and students the safety they deserve @equalrightsadv,California,school closures
2020-05-01 17:27:36+00:00,.@LorenaAD80 please vote YES on #SB493 to protect campus sexual assault survivors. #COVID closures and federal #TitleIX changes have left schools confused and students at risk. Please give colleges the guidance they need and students the safety they deserve @equalrightsadv,California,school closures
2020-05-01 17:27:35+00:00,.@RichardBloom please vote YES on #SB493 to protect campus sexual assault survivors. #COVID closures and federal #TitleIX changes have left schools confused and students at risk. Please give colleges the guidance they need and students the safety they deserve @equalrightsadv,California,school closures
2020-05-01 17:27:34+00:00,.@RobBonta please vote YES on #SB493 to protect campus sexual assault survivors. #COVID closures and federal #TitleIX changes have left schools confused and students at risk. Please give colleges the guidance they need and students the safety they deserve @equalrightsadv,California,school closures
2020-05-05 23:04:55+00:00,"On this global day of giving, please consider an initiative we've been supporting during this crisis - @PCsforPeople @Covid19Kids @GoogleFiber have created a #GiveComputers fund to put computers in the homes of students. https://www.gofundme.com/f/givecomputers",Colorado,school closures
2020-05-04 17:46:29+00:00,Poll: 52% of Parents View Homeschooling More Favorably Since Coronavirus School Closures ,Colorado,school closures
2020-05-03 15:50:31+00:00,You may find the interview with @GeorgeBrauchler and @BrendaBautsch here: https://bit.ly/2KTsER8. Learn more about the impacts of COVID-19 school closures and how leaders can combat the learning losses. #COVID19colorado #COPolitics,Colorado,school closures
2020-05-02 17:38:21+00:00,"My district is providing drive by lunches as are MANY in the country. Your tax dollars fund these school lunch programs, use them. Here is one of MANY articles https://www.google.com/amp/s/kdvr.com/news/coronavirus/colorado-school-districts-offering-meals-during-covid-19-closures/amp/ I agree kids should be the priority here, not pawns for political talking points.",Colorado,school closures
2020-05-01 18:12:49+00:00,"ACTE SmartBrief: HS students in CO share how keep busy during school closure. Wyatt Lockwood, Yuma, has more opportunities-completes agriculture courses via Zoom, misses FFA, now works full-time at Ag supply store &amp; keeps active on family farm. #CACTEnews",Colorado,school closures
2020-05-05 23:44:45+00:00,"Parents and Guardians, please refer to today’s district message regarding school closure for the remainder of the 19-20 school year.",Connecticut,school closures
2020-05-05 18:38:31+00:00,"Daily update @PLVBlueDevils, make sure you check your emails this afternoon, important updates due to the closure of schools in CT for the remainder of the year, TY to everyone participating in spirit day, still time to / #WeArePlainville @PlvComSchools @superlepages",Connecticut,school closures
2020-05-05 17:22:46+00:00,We asked parents their thoughts on the decision to close CT schools for the rest of the 2019-2020 academic year due to COVID-19. Here's what some are saying. Join the conversation! Let us know how the closure will impact your family? Read more&gt;&gt; https://www.fox61.com/article/news/health/coronavirus/gov-lamont-ct-public-schools-to-remain-closed-for-the-rest-of-the-academic-year/520-19d9ba0c-238c-49ec-bf3f-0a39ff058aab,Connecticut,school closures
2020-05-05 16:07:06+00:00,"Teacher appreciation week may look different this year, but there are still ways to safely show your appreciation for the hard work and dedication of teachers.",Connecticut,school closures
2020-05-05 15:27:23+00:00,"It's not unexpected, but the abrupt end of the school year still seems like a shock and many moments of closure will sadly be missed the #WestHartford superintendent said. #WeHa @TownofWestHrtfd https://we-ha.com/connecticut-schools-close-for-academic-year-west-hartford-superintendent-says-focus-is-improving-digital-learning-and-planning/",Connecticut,school closures
2020-05-05 14:29:38+00:00,Connecticut is the 40th state to order the closure of K-12 schools for the remainder of the academic year ,Connecticut,school closures
2020-05-04 16:59:51+00:00,"The P-EBT program provides a card for use at groceries & other food retailers that contains the value of the breakfasts & lunches missed due to school closures—for most of the US, the rate is $5.70/school day. via @CivilEats",Connecticut,school closures
2020-05-04 01:35:11+00:00,"Well if schools reopen this year (eg June 1-30) then I’d agree; however, if they remain closed then the summer vacation time with family will be over 4 mos (from Mar 13 to ?). With possible closure in fall it seems to me that starting 2-3 weeks earlier makes sense.",Connecticut,school closures
2020-05-02 00:42:41+00:00,,Connecticut,school closures
2020-05-01 16:09:28+00:00,"May 1st is National School Lunch Hero Day! A huge thank you Sonia Delgreco, Becky Cerragioli, Lory Lake and Alicia Algarin of @MeridenK12 Food &amp; Nutrition Services! They are continuing to feed students grab &amp; go breakfast and lunch during the school closures. #CTHeroes",Connecticut,school closures
2020-05-01 14:10:21+00:00,"Happy #SchoolLunchHeroDay! @EducateCT is deeply grateful to our #SchoolLunchHeroes on the front lines ensuring our students have cont. access to nutritious meals during school closures. Virtually overnight, you rose to the challenge serving +2 million meals &amp; counting! Thank you! ",Connecticut,school closures
2020-05-05 23:30:13+00:00,A new Healthy Minds blog—Keeping Kids Occupied During School Closure (#5)—highlights some of the best ideas and resources available to help keep children busy and engaged. https://bit.ly/2KZKUse,DC,school closures
2020-05-05 19:55:44+00:00,"Schools need to be ready to cope with more #Covid19 #coronavirus closures, @AmerAcadPeds says",DC,school closures
2020-05-05 18:46:10+00:00,"I suspect these decisions, about how to allocate scarce resources, will delineate Republican and Democratic priorities in a way that shut down orders and school closures did not. ",DC,school closures
2020-05-05 17:00:01+00:00,"School closures due to #COVID19 have left many low-income students without access to free or reduced-price school lunches. In response, Congress created an emergency food assistance program to help prevent students and families from going hungry. ",DC,school closures
2020-05-05 14:50:05+00:00,"2/ First, assume that schools will remain closed this spring but will reopen in the fall (albeit with the potential of localized, 14-to-28-day rolling closures triggered by new outbreaks).",DC,school closures
2020-05-05 14:44:46+00:00,"Our partnership with @BaylorCoHP, @MclaneGlobal &amp; @PepsiCo is expanding the new Meals to You initiative to now serve nearly 5 million meals per week to rural children impacted by #COVID19-related school closures https://go.usa.gov/xvvTZ",DC,school closures
2020-05-05 14:41:08+00:00,Wondering how coaching fits into a school building closure? Struggling to figure out your own place while schools are virtual? I'll be leading a discussion on May 11th to help us come together and share strategies and ideas. Sign up on PLMS under course number 16356.,DC,school closures
2020-05-04 21:25:00+00:00,"Due to school closures from #COVID-19, #Pakistan has launched “Teleschool,” a new children’s media channel airing educational curriculum. In a recent blog post, @NadiaNavi addresses how this channel can strengthen the country’s education system.",DC,school closures
2020-05-04 19:08:24+00:00,"A1: My current happy is that school closure has given me a bit more time and space to work on the non-work-related aspects of me, like reading and cooking more fun stuff (although I'm sure I'm just borrowing that me time from future me, I am appreciating it now!) #fcpsLIT",DC,school closures
2020-05-04 13:41:01+00:00,Sales teams needed to make major shifts thanks to coronavirus-related school closures. These 7 tips explain how several companies approached the challenge. https://edwk.it/35pmGRD,DC,school closures
2020-05-04 11:24:33+00:00,A Timely Response on Learning during School Closures http://hpatrinos.com/2020/05/04/a-timely-response-on-learning-during-school-closures/,DC,school closures
2020-05-03 17:57:02+00:00,Map: Coronavirus and School Closures https://buff.ly/38DeNIl,DC,school closures
2020-05-03 16:00:19+00:00,"""The question, 'What can schools do to specifically support Black students during the school closure crisis?' is not an invitation to pity or save or ogle Black pain."" #EWopinion",DC,school closures
2020-05-02 23:27:00+00:00,Educators are stopping at nothing to reach students in need. But there is still more work to do.,DC,school closures
2020-05-02 21:30:15+00:00,"30 minutes left until we are LIVE! Don't forget to tune in TODAY at 6pm! http://ow.ly/r80V50zv57b I'm going to be joined by Fatma Abukar, a local school teacher in Prince George's County to discuss school closures &amp; supporting minority groups in our education system. ",DC,school closures
2020-05-02 19:22:00+00:00,"#COVID19 changed everything, but NGOs are quickly adapting. Amid school closures and a partial lockdown in #Kenya due to COVID-19, teachers are broadcasting their lessons on the radio in Dadaab refugee camp. Learn more ",DC,school closures
2020-05-02 00:03:20+00:00,"Maryland to survey school districts to assess attendance, engagement during closure ",DC,school closures
2020-05-01 18:45:01+00:00,71% of small business executives said they are very concerned (35%) or somewhat concerned (36%) about their employees who have children at home because of school or child care #COVID19 closures. Read more on the survey we conducted with @MorningConsult:,DC,school closures
2020-05-01 18:21:47+00:00,Today is School Lunch Hero Day! We are grateful for #TeamPGCPS food and nutrition and food service staff who serve students daily and have gone above and beyond despite the COVID-19 closure to continue feeding our community! #PGCPSProud #SchoolNutritionHeroesMD,DC,school closures
