date,text,state,query_term
2020-05-02 15:04:42+00:00,Oh my GOD. The backstory here (it’s in the replies) is that two adult hedgehogs were classroom pets who went home temporarily for the school closure and NOW THERE ARE BABIES baby hedgehogs are called HOGLETS ,New York,school closures
2020-05-01 20:25:42+00:00,Staten Island Yellow School Bus Drivers are Ready to Step Up. #CARESAct #COVID19,New York,school closures
2020-05-01 18:15:02+00:00,So @NYGovCuomo just announced closure of NYC schools for the remainder of the academic yr. @NYCMayor had preemptively announced this same closure weeks ago but Cuomo had said only he can announce such closure. Y'all recall when I said that Cuomo's action was dictatorial &amp; midget,New York,school closures
2020-05-01 17:53:04+00:00,Cuomo Announces Closure of Schools Through End of Academic Year ,New York,school closures
2020-05-01 16:54:46+00:00,Gov. Cuomo: New York schools will close for the rest of the academic year. Closures affect more than 4 million public and private school and college students statewide https://www.wsj.com/articles/new-york-schools-will-stay-closed-for-rest-of-academic-year-due-to-coronavirus-11588350502 via @WSJ,New York,school closures
2020-05-01 13:50:29+00:00,"Plastic partitions, temperature checks, and socially distanced classrooms: how countries are reopening schools following coronavirus closures ",New York,school closures
2020-05-01 10:57:21+00:00,"A very good review of the evidence for school closures by German pediatricians. Bottom line: overall evidence points to minor role of kids in transmission and kids less often ill. Combined with the right for education and with psychosocial benefits, they propose a reopening! ",New York,school closures
2020-05-01 07:04:01+00:00,Several UN agencies – as part of the Global Education Coalition – issued new guidelines to help Governments make decisions on safely reopening schools for the world’s 1.3 billion students affected by ongoing closures. Go to https://buff.ly/2WhFPRc,New York,school closures
2020-05-01 04:48:30+00:00,How schools around the world have been advancing with e-learning is a trendy topic of interest. This research paper reveals much info about the situation in Cameroon. Click on the link below to download. ,New York,school closures
2020-05-01 02:28:08+00:00,How I g2sleep knowing ive done like 1 math assignment since closure + my teacher emailing us all in all caps saying it’s unacceptable there’s no excuse!1 acting as if we aren’t in the midst of a worldwide pandemicByeeeeeee I don’t need any more stress in this life esp from school pic.twitter.com/JVwYUpR0YH,New York,school closures
2020-05-04 16:45:37+00:00,Governor Murphy Announces School Closures for the Rest of the Academic Year. All Students &amp; Educators Will Continue with Remote-Learning. ,New York,school closures
2020-05-04 14:06:22+00:00,It's time for our Daily Writing Prompt! Ask your learner(s) to write about the following: What do you like to do when it's raining outside? #distancelearning #virtuallearning #schoolclosures #socialdistancing #edchat #elemchat #mschat,New York,school closures
2020-05-04 14:01:57+00:00,"For those involved in state education policymaking, join me and a panel of education leaders on Wed. May 6 for a discussion of how we can we prevent opportunity gaps from widening as a result of school closures: ",New York,school closures
2020-05-04 12:40:36+00:00,"""Class of 2020, we are incredibly proud of all that you have accomplished and can't wait to start celebrating you."" In his weekly message, Dr. Pritchard addresses the extended school closure and kicks off #TeacherAppreciationWeek.",New York,school closures
2020-05-04 01:33:00+00:00,"A6) As a parent, I'm still trying to figure it all out! Families can check out the SCRIC Family Toolkit for support https://sites.google.com/btboces.org/scricplic-online-instruction-g/home #wskgcares",New York,school closures
2020-05-03 12:38:06+00:00,"Salva Dut’s message to young people, as told by @LindaSuePark in the Newbery Award-winning A LONG WALK TO WATER is so timely and appropriate for right now as millions of children around the world are living in limbo amidst lockdowns &amp;school closures #SundayMotivation #COVID__19",New York,school closures
2020-05-03 10:27:34+00:00,#Rouhani said mosques in white areas will reopen from May 4. Friday Prayers to also be allowed 132 white districts. But #Iran's president will still face pressure from conservative clerics given closure of religious shrines in other cities. ,New York,school closures
2020-05-03 04:07:57+00:00,"The Class of 2020, missing their Prom, Graduation, Senior Trips and any sort of closure to their 12 years of school really appreciate these selfish, ignorant and negligent assholes.",New York,school closures
2020-05-03 02:05:23+00:00,I wish he had time to go through more of the assumptions/inputs in the model and explain why earlier models showed school closures to beneficial while his new model resulted in the opposite effect,New York,school closures
2020-05-02 05:59:01+00:00,"Coronavirus Closure: High School Seniors Face Graduation Without Returning To Classrooms, Parents With Younger Students Worry About Next School Year ",New York,school closures
2020-05-02 03:32:00+00:00,The news that schools in New York will remain closed for the rest of the academic year has some seniors figuring out ways to say goodbye and parents wondering what the 2020-2021 school year will look like. @AClineThomas reports. https://cbsloc.al/2xr1CxD,New York,school closures
2020-05-01 22:03:58+00:00,This too shall pass. Because the maestro Fyodor Dostoevsky reminds us that “It's the great mystery of human life that old grief passes gradually into quiet tender joy.” —Crime and Punishment #schoolclosures,New York,school closures
2020-05-01 21:35:56+00:00,"As for graduation ceremonies, districts such as #WhitePlains and #Ossining are preparing to celebrate their students remotely.",New York,school closures
2020-05-01 20:49:18+00:00,"RT MaxRose4NY ""RT KristinFDalton: Yellow school buses could cover MTA transit closures, save jobs MaxRose4NY RepMaxRose MikeWReilly #StatenIsland https://www.silive.com/coronavirus/2020/05/reilly-rep-rose-say-yellow-school-buses-could-cover-mta-transit-closures-save-jobs.html""",New York,school closures
2020-05-01 20:22:50+00:00,ppl in my grade r trying to not come to commencement but ive gone to the same school for 13 years and its my home and the teachers are so important to me and its absolutely vital that ppl get the closure they need before the next chapter.,New York,school closures
2020-05-01 18:54:56+00:00,"During #COVID19 school closures, America’s most vulnerable students are at at greatest risk. As educators, students &amp; families, &amp; policymakers continue adjusting plans &amp; responses, @EdTrust is gathering useful resources",New York,school closures
2020-05-01 18:15:14+00:00,"@SteveDeaceShow @AlexBerenson @JordanSchachtel To put the NYS school closure in perspective. School normally would be closing in 8 weeks from now. 8 weeks ago, was March 6th a full 10 days BEFORE the lockdown!!!! Ridiculous.",New York,school closures
2020-05-01 16:33:35+00:00,Where do people need to walk to pick up Rx and toothpaste in Queens? Pick up food from food distribution centers at schools and pantries? - this should have informed BdB’s street closure plan,New York,school closures
2020-05-01 16:04:42+00:00,How are you the state with the most COVID deaths (surpassing most countries as well) and yet the 44th to announce school closures for remainder of year? ,New York,school closures
2020-05-01 15:59:48+00:00,"No surprise Governor #AndrewCuomo announced the closure of schools for the rest of the year. At least the official announcement came at a right time, compared to #BillDeBlasio who called it too early.",New York,school closures
2020-05-04 01:33:06+00:00,I've started to put together videos on how to complete GC assignments for students and parents-- I agree Steve-- any help we can give them. Also check out this resource from RIC,New York,school closures
2020-05-04 01:32:59+00:00,I love that you mentioned #PBL. We've been having conversations in the @broomeBOCES region about opportunities for authentic learning during #schoolclosures,New York,school closures
2020-05-03 15:27:20+00:00," What a fantastic + creative way to incorporate #nearpod into Social Studies #remotelearning! #virtualfieldtrips Would love to show you how you can create these #choiceboards for your district, as well! DM for more info #distancelearning #edtech #schoolclosures ",New York,school closures
2020-05-03 15:21:15+00:00,"For me, there was also a lot of frustration and lack of belief that people could take social distancing seriously. I argued with you on this site about NYC DOE school closure mostly because, while people were demanding schools close, the playgrounds were always packed.",New York,school closures
2020-05-03 12:39:32+00:00,"UNICEF @UNICEF reports: 1,287,571,163 affected learners are not in school worldwide. That is 73.5% of total enrolled learners. And, 182 country-wide closures.",New York,school closures
2020-05-02 11:55:01+00:00,Around 63 million #teachers around the are affected by school closures due to the #COVID19 pandemic. We must #SupportTeachers so #LearningNeverStops http://on.unesco.org/2VMuOXZ,New York,school closures
2020-05-02 04:38:44+00:00,"The #COVID19 school closure highlights the digital divide in education worldwide. In this time of crisis, @UNPeacekeeping radios play a key role in reaching out to children with remote educational programs. 1 example is @MONUSCO's @radiookapi in the #DRC",New York,school closures
2020-05-01 19:49:59+00:00,"Reilly, Rep. Rose say yellow school buses could cover MTA transit closures, save jobs ",New York,school closures
2020-05-01 18:30:38+00:00,"he has talked himself in circles when it comes to how closures &amp; reopenings 'must' be done. NY must coordinate with neighboring states but it's also OK to do a regional approach within NY? schools and businesses go together, until they don't... ",New York,school closures
2020-05-01 17:47:50+00:00,"We at IntegrateNYC have been assessing the needs of our youth communities since school closures due to COVID-19. With many in need of direct financial support we are now opening an emergency Youth Aid Fund!! OUR ASK! Help us raise $5,000! Link here: ",New York,school closures
2020-05-01 17:10:35+00:00,"A Gleaner article seemed to indicate that this included the school locations. ""The Mother’s woes started with the fallout in the tourism industry and the closure of the 10 schools in which it operates as concessionaires, said Richard Foreman, its chairman"" ",New York,school closures
2020-05-01 16:19:11+00:00,Cuomo announces extended school closures: ‘We must protect’ students and educators https://www.msnbc.com/msnbc/watch/cuomo-new-york-schools-closed-for-rest-of-academic-year-distance-learning-to-continue-82875461944 via @nbcnews,New York,school closures
2020-05-01 14:31:20+00:00,"For Britain, school closures compound pre-existing problems within the education system, says @ThereseRaphael1 (via @bopinion)",New York,school closures
2020-05-01 14:00:21+00:00,It's time for our Daily Writing Prompt! Ask your learner(s) to write about the following: What is your favorite childhood memory? #distancelearning #virtuallearning #schoolclosures #socialdistancing #edchat #elemchat #mschat,New York,school closures
2020-05-01 12:04:47+00:00,"With no last day of school, kids will need help with closure — here's what experts say parents should do (by @erinnemagee)",New York,school closures
2020-05-01 12:00:01+00:00,"192 countries have implemented nationwide school closures, adversely impacting the learning of 91% of the world’s student population, over 1.5 billion learners (@UNESCO, 30 March 2020) #COVID19 @_GenUnlimited",New York,school closures
2020-05-01 11:05:11+00:00,Who used to go to @FPNYC after school? The Village Comic and Pop Culture paradise is hoping to survive the #COVID Pandemic closure and has a @gofundme page for folks to help #Comics #SciFi #Books #NYC #ForbiddenPlanet @jeffayers http://www.gofundme.com/f/help-forbidden-planet-nyc-survive,New York,school closures
2020-05-01 04:08:28+00:00,I’m tired of comparisons of #covid19 response of NY vs. Wash. or CA. NY 1st case was Mar. 3. Effective school closure was March 13. Visitors in Feb. alone were over 6 million from European hotspots. Population/Density/dependence on mass transport created the perfect storm. ,New York,school closures
2020-05-01 03:34:46+00:00,Only 30% of black/ Hispanic students are at grade level in DOE schools. Why aren’t you calling out this crisis in failing to educate our kids by DOE that’s only getting worse with Covid19 school closures?,New York,school closures
2020-05-03 07:42:29+00:00,"Reilly, Rep. Rose say yellow school buses could cover MTA transit closures, save jobs - http://SILive.com https://www.silive.com/coronavirus/2020/05/reilly-rep-rose-say-yellow-school-buses-could-cover-mta-transit-closures-save-jobs.html #NewYork #Transit #NYC #MTA",New York,school closures
2020-05-02 16:52:00+00:00,"How will #COVID19 affect public school resources and teacher retention this fall? TC’s Michael Rebell, director of the College’s Center for Educational Equity, weighs in — via @MotherJones &amp; @kieraevebutler. #SchoolClosures #OnlineLearning",New York,school closures
2020-05-02 14:00:48+00:00,"With the current pandemic & school closures, most learning has moved online. Educators are now asking: What's the best way for students to learn digitally? Computer games could be the answer, according to a new book co-edited by @GC_CUNY Prof. Bruce Homer https://sum.cuny.edu/digital-learning-computer-games-digital-graduate-center/",New York,school closures
2020-05-01 23:17:37+00:00,"3/Switzerland reopens its schools on May 11, based on research showing that school closures were among the least effective measures at reducing European Covid cases. In the U.S. the effect of the closures has been catastrophic for public school students. And 4 ""essential"" parents",New York,school closures
2020-05-01 20:20:20+00:00,"Yellow school buses could cover MTA transit closures, save jobs @MaxRose4NY @RepMaxRose @MikeWReilly #StatenIsland https://www.silive.com/coronavirus/2020/05/reilly-rep-rose-say-yellow-school-buses-could-cover-mta-transit-closures-save-jobs.html",New York,school closures
2020-05-01 02:06:53+00:00,"As #COVID19 #schoolclosures affect nearly 1.3 billion students worldwide, @UNICEF @UNESCO, @WFP, and the @WorldBank have issued new guidelines on the #safe reopening of schools. https://www.unicef.org/media/68366/file/Framework-for-reopening-schools-2020.pdf",New York,school closures
2020-05-01 00:00:11+00:00,#Estonia's Pathfinder Centers provide resources and support during #schoolclosures https://buff.ly/3cVVv3i via @CtrEdEcon #education Estonia's Rajaleidja (Pathfinder) Centers are regional counseling centers that provide free support services for students and families,New York,school closures
2020-05-05 23:23:58+00:00,"that's basically my evolution in this as well. First three weeks fine, next three weeks getting skeptical, the extension through May with the school facility closure through June driving me to the total anger zone.",Ohio,school closures
2020-05-05 23:11:13+00:00,"Stay away from Chinese publications. How about the Lancet. https://www.thelancet.com/journals/lanchi/article/PIIS2352-4642(20)30095-X/fulltext. “Recent modelling studies of COVID-19 predict that school closures alone would prevent only 2–4% of deaths, much less than other social distancing interventions.”",Ohio,school closures
2020-05-05 18:50:08+00:00,"Today's #ResourceRecommendation is for teachers! BrainPOP Educators is offering FREE access for anyone impacted by school closures: https://educators.brainpop.com/ Lesson planning, professional development, and interactive tools/ enrichment for K-12 students ",Ohio,school closures
2020-05-05 16:34:57+00:00,Second Snapshot of School Librarian Roles during School Closures https://knowledgequest.aasl.org/second-snapshot-of-school-librarian-roles-during-school-closures/ via @aasl,Ohio,school closures
2020-05-05 15:29:00+00:00,"4th grade teacher & @tftunion leader (@aftunion Local 250) @catheri2041, talks about how she and other Toledo teachers are keeping students engaged during school closures, while also helping take care of their own children and grandchildren. #TeacherAppreciationWeek",Ohio,school closures
2020-05-04 22:45:30+00:00,"David Spridgeon, a K-12 Phys Ed teacher & President of Arcadia Teachers Org. (@aftunion Local 4783) gives #TeacherAppreciationWeek shout-outs to Arcadia teacher Clay Baker &amp; former Arcadia teacher @MrHamiltonPE for keeping kids engaged through the school closures. ",Ohio,school closures
2020-05-03 23:29:10+00:00,I have watched every Big Brother season and have been binge-watching Survivor during our school closure. I definitely think Survivor is better. I find that I like most of the Survivor contestants. It's the opposite with Big Brother. Survivor is dynamic. Big Brother-stagnant,Ohio,school closures
2020-05-03 18:50:22+00:00,"Tomorrow the seniors would have started our last week of high school, where we all would’ve said goodbye, as we leave to do other things with our lives. And now how much closure do I have on that chapter of my life? None.",Ohio,school closures
2020-05-03 09:48:41+00:00,& the only reason my card wasn’t in my wallet was because some girl from high school that has HATED me since we were like ??? idk 12 ???? was also in the lecture and although dream me never for closure that she was the one who took it im still convinced she did ,Ohio,school closures
2020-05-02 12:22:57+00:00,"The closure cost schools a lot, school cafeterias are self funded in my area not sure if that’s true everywhere. Because we all are contracted we still got paid as normal, we weren’t bringing money in, and we have been providing free breakfast and lunch for kids 1-18 since March.",Ohio,school closures
2020-05-02 12:08:40+00:00,OH just extended closure to all school buildings until June 30. ,Ohio,school closures
2020-05-02 11:57:00+00:00,"A smart move for @GovMikeDeWine @MikeDeWine would be to commit now that schools will open on time. Overwhelming science supports this, data etc., and it would help any district with levies on the ballot to pass. You don't pass levies during school closures. It will save jobs..",Ohio,school closures
2020-05-02 00:58:40+00:00,"I hope everyone realizes, kids aren’t going back to school as normal in the fall. Schools are making major cuts in their staff, and are preparing for much lower enrollment, and long closures for hotspots and outbreaks.",Ohio,school closures
2020-05-01 17:38:50+00:00,Why is everyone upset didn’t you see the recent study that showed only 2-4% increase in mortality due to schools being open? That’s catastrophic data right there. https://www.thelancet.com/journals/lanchi/article/PIIS2352-4642(20)30095-X/fulltext,Ohio,school closures
2020-05-01 11:42:03+00:00,"OHSAA sent out a “clarification” email to administrators tonight. In summary, the “No Contact Period” is currently set through 05/31/20; however, will be extended to meet the “school facilities closure date” (currently 06/30/20). The hope is that the order may be lifted sooner.",Ohio,school closures
2020-05-03 17:50:04+00:00, Supporting parents during school closures? Check out 7 top tips for distance learning and homeschooling! ,Oklahoma,school closures
2020-05-03 15:58:10+00:00,"NOAA Live! Webinars for Kids The National Oceanic and Atmospheric Administration (NOAA) is offering this series on Monday, Wednesday, and Friday at 11 EDT during school closures. Register at the link below. https://seagrant.whoi.edu/suggested-educational-resources-for-use-during-school-closures/webinars-noaa-live/ #NOAALive4Kids #RayLoyerRealtor",Oklahoma,school closures
2020-05-01 21:00:25+00:00,"Yup - it's #SchoolLunchHero Day! Thank you so much to @KleinISDfood for all they do each day. They have distributed over 278,000 meals to Klein ISD families since the start of our school closures. The staff on our Nutrition &amp; Food Services team are truly amazing. #kleinfamily",Oklahoma,school closures
2020-05-03 15:31:58+00:00,"NOAA Live! Webinars for Kids The National Oceanic and Atmospheric Administration (NOAA)'s is offering this series on Monday, Wednesday, and Friday at 11 EDT during school closures. Register at the link below. https://seagrant.whoi.edu/suggested-educational-resources-for-use-during-school-closures/webinars-noaa-live/ #NOAALive4Kids #TWFGRussellKnapp",Oklahoma,school closures
2020-05-05 16:19:43+00:00,"In 2014, a school in Liberia closed for 6 months due to Ebola. What insights can this school now offer to schools across the globe dealing with #Covid19 closures? Lots. https://bit.ly/3dhbf15 @npr_ed @educationweek @EWAEmily @LauraAJarrett @DanaGoldstein @Sonali_Kohli",Oregon,school closures
2020-05-04 23:00:04+00:00,"“It’s kind of a double whammy of starting to forget and losing that kind of academic mindset being out of school and missing out on a couple of important months of instruction, particularly for young kids."" ",Oregon,school closures
2020-05-04 15:44:52+00:00,@OHEducation is providing a newsletter specifically for school district preschool special education staff as they continue to provide services during Ohio’s ordered school-building closure. SST 1 has posted this newsletter online at https://www.sstr1.org/?p=53733 #InThisTogetherOhio,Oregon,school closures
2020-05-03 19:01:40+00:00,It’s ‘devastating’ for students who rely on music classes - The Washington Post,Oregon,school closures
2020-05-03 18:51:33+00:00,"The forced closures is more about whose in the WH , less about virus. H1N1 during Obama's presidency NO CLOSURES, NO MASKS, NO SOC DISTANCES, NO SCHOOL CLOSURES. We had a crap economy, hi gas prices, over run w/illegals, GNP maybe 1%. Hemorrhaging $$Trump changed everything! ",Oregon,school closures
2020-05-03 15:10:30+00:00,These are good strategies for maintaining relationships with our students during this time. #parkrosestrong 7 Ways to Maintain Relationships During Your School Closure | Edutopia ,Oregon,school closures
2020-05-03 08:53:26+00:00,Here's the link what the govonor says about the repeat grade policy that you don't have to repeat the grade,Oregon,school closures
2020-05-01 20:57:19+00:00,"While it will feel a little different than the first article in our new Access To Art series, consider this article a ""#quarantine edition."" It looks at how Oregon educators are teaching arts to students in the wake of school closures due to #COVID19.",Oregon,school closures
2020-05-01 00:32:31+00:00,Athletes /Parents- please check your email for an important update regarding ODH closure of school facilities until June 30 and OHSAA extension of the no contact period until May 31. There is NO access to athletic facilities until further notice - this will be enforced.,Oregon,school closures
2020-05-05 10:52:57+00:00,,Pennsylvania,school closures
2020-05-04 07:38:28+00:00,"edutopia: Teachers shared their best ideas on how to maintain the relationships that drive engagement and learning—in this new, decentralized world.",Pennsylvania,school closures
2020-05-01 11:41:10+00:00,"No need for a cape when you have an apron! Today is National School Lunch Hero Day and our food service staff are heroes, for sure! Help us celebrate our amazing staff who have served over 61,000 meals since our school closure! #SchoolLunchHeroDay #WestShoreProud",Pennsylvania,school closures
2020-05-04 00:52:33+00:00,During the closure I have gone back through my phone looking at amazing memories that took place in our schools so I could remember how amazing it was and how amazing it will be when this is over. @CentralSquareSD,Rhode Island,school closures
2020-05-03 14:09:57+00:00,7 Ways to Maintain Relationships During Your School Closure via ⁦@edutopia⁩,Rhode Island,school closures
2020-05-02 19:39:15+00:00,"10 miles an hour? Well, I guess Elorza has to find SOME way to recoup the millions in lost speeding tickets due to extended school closures and zero traffic passing his despicable school zone speed cams. Unconscionable. @Jorge_Elorza",Rhode Island,school closures
2020-05-01 16:03:18+00:00,"Guys, I knew it was coming, but I’m not handling this NYS school closure news well ",Rhode Island,school closures
2020-05-01 16:01:09+00:00,Should college students get a refund? A Brown University student is suing the school to get his money back after the campus closed due to the pandemic @NBC10,Rhode Island,school closures
2020-05-01 15:01:19+00:00,"A Brown University student has filed a class-action lawsuit against the Ivy League school seeking reimbursement for tuition, room, board and other expenses associated with the campus closure in response to the coronavirus pandemic. ",Rhode Island,school closures
2020-05-01 22:38:25+00:00,"YOUR WEEKLY UPDATE Click to read information regarding the extended school closure, August Regents Exams, and more. https://bit.ly/3dbiVlh #WeAreSE #SEStrong",Rhode Island,school closures
2020-05-04 18:04:00+00:00,Parents are growing anxious with schools closed for months as education experts begin to warn of a possible “COVID slide” for students. ,South Carolina,school closures
2020-05-02 02:18:34+00:00,Fort Jackson extends closure of post schools ,South Carolina,school closures
2020-05-05 00:25:04+00:00,"#COVIDslide will be worse than #SummerSlide. To ensure that our kids have a bright future, let's work together to close this learning gap.",Tennessee,school closures
