date,text,state,query_term
2020-05-05 19:00:34+00:00,"Take advantage of these day-by-day projects to keep kids reading, thinking, and growing. #StrongerTogether #StayWithUs",Georgia,school closures
2020-05-05 02:07:28+00:00,"@johnkrasinski Howell High School is still holding our annual Senior Survivor competition this year even with the closure! We have raised over $488,000 during the past 12 years of this competition! We would love to be on SGN! ",Georgia,school closures
2020-05-05 00:05:03+00:00,School closures leave homeless students even more vulnerable ,Georgia,school closures
2020-05-04 19:39:36+00:00,"Earlier today, @GovMurphy extended New Jersey's statewide school closure for in-person instruction through the remainder of the academic year due to the coronavirus pandemic. @njdotcom https://bit.ly/3c38MXL",Georgia,school closures
2020-05-04 18:12:28+00:00,5/4/20 School Closure Update! https://www.newegypt.us/cms/lib/NJ01001837/Centricity/Domain/4/COVID19050420.pdf,Georgia,school closures
2020-05-04 16:51:32+00:00,Governor Phil Murphy today announced that statewide school closures will be extended through the end of the 2019-2020 academic year. #COVID19,Georgia,school closures
2020-05-04 16:50:51+00:00,"collegiate banners to be on display along Main Street in Helmetta to proudly honor the graduates within Helmetta. As a high school student, this will allow me some closure and ease the disappointment of canceling events. #NJThanksYou",Georgia,school closures
2020-05-04 14:20:33+00:00,@GovMurphy give us a choice . Many children miss their friends and teachers. Check the cdc numbers - the REAL numbers don’t warrant school closures.,Georgia,school closures
2020-05-04 12:59:51+00:00,Check out how teachers around the world have used @CodeCombat and @PlayOzaria during #distancelearning and in their #remoteteaching efforts. Interested? Let's chat! https://bit.ly/2KUzqq3 #togetherapart #remotelearning #edtechchat #coding,Georgia,school closures
2020-05-01 22:17:24+00:00,I know many teachers and leaders in Gwinnett all concerned about this. https://www.forestoftherain.net/click-our-blog-your-voice/open-letter-to-brian-kemp-governor-of-georgia-from-a-concerned-teacher-jason-b-allen-jballen5 Have GA schools been cleaned since sudden closures? How will this impact teachers w/pre existing conditions? #protectteachers @AAEteachers @edu_post @PGeducator @KeishaBottoms,Georgia,school closures
2020-05-01 15:45:00+00:00,"Since the closure of school due to the Covid-19 outbreak, the leadership and staff at @CCSPNJ have been hard at work to keep students actively engaged with the school community. Great work! https://bit.ly/2SjKIs4",Georgia,school closures
2020-05-01 13:46:00+00:00,Children living through isolation and school closures after the #COVID19 outbreak in #China experienced significantly higher rates of depression and anxiety symptoms.,Georgia,school closures
2020-05-05 23:26:28+00:00,Support @GCNFoundation fundraising for School Food &amp; COVID-19: Supporting Children and Families during closures : ,Hawaii,school closures
2020-05-03 00:09:56+00:00,Wave 2 in the fall is going to be awful. I’m anticipating school closures again.,Idaho,school closures
2020-05-01 19:35:35+00:00,It was the right decision by Cuomo but I'm sad for the schools in my district that are projected to close especially since teachers and students will not have the opportunity for one last hug. The lack of closure saddens me. ,Idaho,school closures
2020-05-01 15:59:09+00:00,"My heart... hurts for my students, for my fellow teacher colleagues and for anyone else effected by this school closure.",Idaho,school closures
2020-05-05 19:18:39+00:00,"When you donate our Emergency Relief Campaign for #GivingTuesdayNow, you support our amazing teaching artists who've lost several work opportunities due to school closures. Help keep our artists working &amp; our communities engaged in the arts! https://secure.givelively.org/donate/young-audiences-of-indiana-inc/arts-for-learning-emergency-relief-fund",Indiana,school closures
2020-05-02 15:08:29+00:00,"""A week later, with pressure mounting, the Board of Health voted to lift the ban of public gatherings and school and business closures on October 31. Cases surged. By November 18, 656 new cases had been reported and an influx of influenza patients filled City Hospital."" ",Indiana,school closures
2020-05-05 22:17:53+00:00,"I've had a few people DM me and ask about the donation that has been returned (in the form of credits) from the SeaLife Center project that I had to cancel due to the closure of schools. If you need help understanding how to use your credits, please DM me and I will try to help.",Iowa,school closures
2020-05-05 17:32:18+00:00,"My children as well. Their current, before closures, grades will stay and if they turn HW in, their grades will only get better. I try to explain best I can but I didn't go to school for that. Usually ends up in a 20 minute explanation for 1 question.",Iowa,school closures
2020-05-05 01:49:24+00:00,"A5: Standardized assessment for math, reading, & science was cancelled in Iowa this year due to school closure. #ELLChat",Iowa,school closures
2020-05-05 01:40:08+00:00,A4: Instruction since school closure has only been focused on essential standards. #ELLChat,Iowa,school closures
2020-05-05 01:13:15+00:00,"A2: My district is only giving grades at high school (9-12) for required learning. Their are different options, but the grade can't be lower than what it was before school closure. #ELLChat",Iowa,school closures
2020-05-03 00:25:09+00:00,For Ts - What's one thing you've learned about yourself as a teacher during school closure? For Ss - What do you wish your T knew about you (esp now that school's closed)? #ELLChat,Iowa,school closures
2020-05-02 14:58:21+00:00,"Happy School Lunch Hero Day! Thank you to EVERYONE who keeps our children fed during the school year, and during this school closure. Your efforts are truly heroic! #sepolk @SEPFoodService",Iowa,school closures
2020-05-02 13:43:29+00:00,Taking a challenge (no family events due to school closure) and finding an opportunity (using Facebook Live to engage families - at their convenience) @ChapaTISD #MADpd https://www.youtube.com/watch?v=DkTygid9gRI&amp;feature=youtu.be,Iowa,school closures
2020-05-01 17:24:32+00:00,"Thank You Southeast Polk Principals! We always appreciate you but now more than ever. Thanks for everything, especially during this time of school closure! #sepolk",Iowa,school closures
2020-05-04 19:40:00+00:00,Some parents are growing concerned about the impact of the coronavirus pandemic on their children’s education.,Kansas,school closures
2020-05-04 19:13:48+00:00,Poll: 52% of Parents View Homeschooling More Favorably Since Coronavirus School Closures https://www.breitbart.com/politics/2020/05/04/52-parents-view-homeschooling-more-favorably-coronavirus-school-closures/ via @BreitbartNews,Kansas,school closures
2020-05-03 02:43:07+00:00,"School closures are impacting children and families, so @ClintonFdn quickly pivoted to help by partnering with @WCKitchen &amp; @CityLittleRock to provide 185k+ meals, at home learning resources for parents nationwide, and more. #COVID19 #philanthropy #brands",Kansas,school closures
2020-05-05 06:51:55+00:00,"School closures are impacting children and families, so @ClintonFdn quickly pivoted to help by partnering with @WCKitchen &amp; @CityLittleRock to provide 185k+ meals, at home learning resources for parents nationwide, and more. #COVID19 #philanthropy #brands",Kansas,school closures
2020-05-05 21:49:33+00:00,https://www.theguardian.com/education/2020/apr/06/school-closures-have-little-impact-on-spread-of-coronavirus-study,Kentucky,school closures
2020-05-05 18:24:54+00:00,"When I woke up this morning, I just had this ache in my heart. Because now those students' senior year has ended so abruptly. No graduations. No lock-ins. No senior parties & huge school-wide goodbyes. Closure is so critically important so you can move on to the next big thing.",Louisiana,school closures
2020-05-04 13:52:18+00:00,"@nolanews reports southeast Louisiana schools coming through for #LouisianaChildren with ""an eye-popping 1.7 million meals across the seven-parish metro area since Gov. John Bel Edwards announced statewide school closures in March."" ",Louisiana,school closures
2020-05-03 17:50:02+00:00, Supporting parents during school closures? Check out 7 top tips for distance learning and homeschooling! ,Louisiana,school closures
2020-05-03 15:33:17+00:00,"NOAA Live! Webinars for Kids The National Oceanic and Atmospheric Administration (NOAA)'sis offering this series on Monday, Wednesday, and Friday at 11 EDT during school closures. Register at the link below. https://seagrant.whoi.edu/suggested-educational-resources-for-use-during-school-closures/webinars-noaa-live/ #NOAALive4Kids #TWFGTonyVoiron",Louisiana,school closures
2020-05-01 19:00:00+00:00,#LaEd school facility closures due to #COVID19 have led to uneven continuous learning across the state: https://bit.ly/3bTWWiF #FridayFive,Louisiana,school closures
2020-05-05 12:05:25+00:00,"Lol @my high school “friend” who posted a long list of screenshots of Maine businesses announcing closures, most of which were struggling financially before this started. Some of them even wrote it wasn’t due to the pandemic in their posts, but sure, let’s blame the governor",Maine,school closures
2020-05-04 20:50:19+00:00,"Happy teacher appreciation week! I would like to thank all GCS Primary School teachers you for their dedication, support and hard work throughout the school year and especially during this long term closure! You are all amazing!",Maine,school closures
2020-05-04 01:32:42+00:00,"A6) We have put together this page, which has some resources for parents: https://sites.google.com/btboces.org/school-closure-technology-supp/#btedtech #wskgcares",Maine,school closures
2020-05-04 01:23:26+00:00,A4) Absolutely. Our Professional Learning and Innovation Center team has put together some great resources here: https://sites.google.com/btboces.org/scricplic-online-instruction-g/home?authuser=0 #wskgcares #btedtech,Maine,school closures
2020-05-03 23:52:23+00:00,The lack of closure from not having the whole finals week at school plus packing and leaving with everyone is going to bother me for the entire summer,Maine,school closures
2020-05-01 21:33:05+00:00,Governor Cuomo announces school closures for the rest of the academic year ,Maine,school closures
2020-05-05 22:15:39+00:00,"3/ If we look at disease models, we need to look at economic and health models too. This decision cannot be made in silos. And let's not get started on the (nonexistent) evidence base for school closures and diminishing base for lockdowns period...",Maryland,school closures
2020-05-05 19:17:45+00:00,"With school closures, shutdowns of nonessential businesses and escalated unemployment. Senior citizens, families that rely on school meals and low-income or hourly workers are the most affected groups. Help feeding families who are in needs Donate at ",Maryland,school closures
2020-05-05 18:27:41+00:00,Honor the teachers by letting them know the plan for the school year. Most of the country has updated their citizens about school closures through the end of the academic year. You are once again allowing ms.Salmon to drag her feet on informing everyone ,Maryland,school closures
2020-05-05 14:11:01+00:00,"The annual ""summer slide"" could be ""supercharged"" for students having a hard time with #remotelearning during #COVID19 school closures. What will districts do to support them? http://ow.ly/iXLH50zxmIl #education",Maryland,school closures
2020-05-05 01:31:32+00:00,"A blueprint for back to school | American Enterprise Institute - AEI~ A comprehensive doc to download. Big buckets covered...esp. like Whole Child (SEL) supports &amp; inclusion of ⁦@CDCgov⁩ leveled response 4 closures chart. When safe, but plan now! ",Maryland,school closures
2020-05-05 00:43:47+00:00,FSK Teachers have been ROCKing and ROLLing during the school closure! Thank you for your service. ,Maryland,school closures
2020-05-05 00:34:48+00:00,"Teachers make a difference everyday! We thank you for encouraging, inspiring and making learning fun. During this unfortunate school closure and always, KEY teachers are amazing! #KEYteachersROCK",Maryland,school closures
2020-05-04 16:51:25+00:00,Families and teachers are experiencing challenges right now...this article shares some perspectives:,Maryland,school closures
2020-05-03 23:00:00+00:00,"This letter was written and printed before the announcemnt of the school closures, but he did get it right: ""Even though it's been hard to stay at home and get my schoolwork done, especially algebra, I don't think we should go back until the fall. "" ",Maryland,school closures
2020-05-03 17:00:00+00:00,"In this weekend's letters to the editor, people talk about President Trump and the pandemic, as well as school closures. Submit your letter to letters@thedailystar.com ",Maryland,school closures
2020-05-03 14:00:01+00:00,Do you think Gov. Cuomo made the right call on schools? https://www.thedailystar.com/news/local_news/local-schools-lament-state-closure-prepare-for-future/article_d145e646-1f31-5ec8-af22-65fe1a21bc33.html Story by @DS_GregK,Maryland,school closures
2020-05-02 17:14:56+00:00,"Know what makes me the saddest about this school closure? My 8th graders worked on this bilingual clay mural for months &amp; finally finished it the Friday we left school (3/13). For size reference, it is 3 4'x3' panels so it is 12 feet long! ",Maryland,school closures
2020-05-02 17:00:51+00:00,"""Right now it’s everybody trying to make do. This period of closure this spring is really showing us the deficits and what we need to beef up on. It’s been a huge learning curve. Our educators have stepped up to the challenge."" -MSEA President @BostCAB",Maryland,school closures
2020-05-02 15:03:22+00:00,USA TODAY: Is Mark Zuckerberg-backed program the answer for school closures? ,Maryland,school closures
2020-05-02 14:30:06+00:00,Maryland’s school districts will be surveyed by the state to assess student participation in #remotelearning. http://ow.ly/bfWv50zuW1E via @KateRyanWTOP,Maryland,school closures
2020-05-01 21:26:10+00:00,"Updated school closure list. MT allows for reopening next week but nobody has taken the governor up on it. WY for ""special groups"" only. NJ announcing Mon./Tues., CT within 10 days. MD...complete radio silence. @MdPublicSchools is embarassing our state on a national level.",Maryland,school closures
2020-05-01 16:55:51+00:00,"Stay tuned later today for this week’s episode of #SNAWeeklyWrap featuring #LunchHero, Sharon Glosson. Find out how North East Independent School District - NEISD served 1 million meals during COVID-19 closures! #SchoolLunchHeroDay #SchoolLunchHeroes #SLHD",Maryland,school closures
2020-05-01 16:46:07+00:00,"ALBANY — New York's public schools must stay closed for the remainder of the current academic year and should begin working on reopening plans, Gov. Andrew Cuomo announced Friday. ",Maryland,school closures
2020-05-01 13:24:37+00:00,"Amazing! Since March 17, HCPSS has served 472,892 meals. Thank you to all our @hcpssfoodsvc Food and Nutrition Services staff who made this happen, and continue to ensure our students remain fed during school closures. @SchoolLunch #SchoolLunchHeroDay #CelebrateHCPSS",Maryland,school closures
2020-05-01 12:01:54+00:00,Thank you to the #foodservice staff who continue to feed kids during school closures. #SomeGoodNews #LunchHeroes #SchoolLunchHeroDay,Maryland,school closures
2020-05-05 18:47:14+00:00,"...But large-gatherings bans, school closures, and emergency declarations are not associated with increases with searches for claiming UI. ",Massachusetts,school closures
2020-05-05 18:47:12+00:00," Updated paper How do #shutdown policies affect unemployment during #COVID19? We now study six different policies: restaurant/bar limits, non-essential business closures, stay-at-home orders, large-gatherings bans, school closures, and emergency declarations. Thread ",Massachusetts,school closures
2020-05-05 16:45:36+00:00,"In honor of #ChildrensMentalHealthWeek, we'd like to take a moment to recognize that, with school closures, physical distancing, &amp; disruptions to routines, this can be a particularly challenging time for your child's mental health. There are resources available to help: ",Massachusetts,school closures
2020-05-05 15:23:23+00:00,"Modelling suggests that in Shanghai school closures alone would not have stopped the epidemic — but did lower the number of new infections per day at the epidemic’s peak, which relieved stress on hospitals. ",Massachusetts,school closures
2020-05-05 14:34:28+00:00,"Attn WPS families: If your children qualify for free or reduced-price school meals, you’ll soon receive help to buy food during school closures associated with #COVID19. More: http://www.wpsk12.com http://www.MAp-EBT.org/ @projectbread 800-645-8333",Massachusetts,school closures
2020-05-05 13:13:10+00:00,"This study says kids are not major #COVID19 spreaders. In Australia, the PM told schools to stay open, believing kids weren’t at risk &amp; closing schools would impact healthcare and the economy. The PM was criticized but Australia is now seen as a success. https://tinyurl.com/ya6h2yp3",Massachusetts,school closures
2020-05-05 08:13:04+00:00,"Weymouth Public Schools shocked parents and students last week when the district announced that budget issues, stemming from the coronavirus pandemic, threatened the closure of Nash Primary School. Monday, the district said the school would not close down. ",Massachusetts,school closures
2020-05-04 22:00:02+00:00,"#COVID19 has forced the closure of K-12 schools around the world, prompting #education systems to rapidly implement remote learning. Now school systems must focus on four major priorities—and put equity front and center. ",Massachusetts,school closures
2020-05-04 16:36:34+00:00,"During Teacher Appreciation Week, we’re sharing parent quotes from the family survey about how CPS teachers are supporting students and families during the emergency closure. #CambridgeTeacherAppreciation #CambPS",Massachusetts,school closures
2020-05-04 15:15:00+00:00,Read FEV Tutor's partner spotlight on how Live 1:1 Online Tutoring is supporting @BaltCitySchools students during school and district closures. #edtech #partnership #bcps #onlinelearning #learningmustcontinue,Massachusetts,school closures
2020-05-04 14:00:17+00:00,"Today starts Teacher Appreciation Week & we're excited to celebrate our teachers (as usual!)—especially as they continue to rally for students & families during school closure. Thank you, Natick Teachers for your dedication &amp; all that you do! #ThankATeacher (cc: @annapnolin)",Massachusetts,school closures
2020-05-04 10:36:45+00:00,Honestly. The smartest call for the governor to make was extending the early childcare center closures til the end of June. It wouldn’t be surprising if it gets extended as long as the public schools. We need to make sure everyone can be completely safe.,Massachusetts,school closures
2020-05-02 21:02:02+00:00,"Seattle went to school closures first. In NYC, de Blasio for weeks was saying that keeping the schools open was a pillar of his coronavirus response. It shows you what de Blasio was doing: looking at his relationships with the education unions and nurses unions. — Slate",Massachusetts,school closures
2020-05-02 20:00:47+00:00,"#HBFamilyReading: Margo Bartlett on being a ""volunteer grandma"" in her grandson's 1st-grade class (written before COVID-19 school closures) #FamilyReading https://www.hbook.com/?detailStory=volunteer-grandma",Massachusetts,school closures
2020-05-02 12:35:04+00:00,"Many states have temporarily suspended standardized testing, including exit exams, as part of ongoing school closures due to the Covid-19 pandemic. As decision-makers consider reinstating tests, new research findings may be of particular relevance: http://ednxt.co/2VL2ztK",Massachusetts,school closures
2020-05-01 21:00:00+00:00,Many communities in Massachusetts are organizing “adopt-a-senior” programs and surprising them with gifts.,Massachusetts,school closures
2020-05-01 17:06:59+00:00,"With school closures, colleges moving online, and testing dates cancelled, so much about education is in flux. Join us for a live Q&amp;A May 13 at 1PM ET. We'll address your questions and share ideas for making the most of this time at home. Register here: https://hubs.ly/H0q3fzL0",Massachusetts,school closures
2020-05-01 16:16:42+00:00,Winchester High School senior parade is currently stuck. Apparently admin thought a road closure due to construction didn’t apply to them @JudithEvans1,Massachusetts,school closures
2020-05-01 16:04:12+00:00,"Happy #SchoolLunchHeroDay! Throughout this difficult period of school closure, our Food &amp; Nutrition Services staff and volunteers have stepped up to make sure @BostonSchools students and families have access to free, nutritious meals every day. Thank you! ",Massachusetts,school closures
2020-05-01 14:53:30+00:00,"ONE WEEK LEFT TO BUY YEARBOOKS! Due to the school closure, yearbook sales will ONLY be online this year. The deadline for ordering a CCS Yearbook is next Friday, May 8. ",Massachusetts,school closures
2020-05-05 13:41:38+00:00,His response was weak and slow. Masks on May 6th? May be it should have been done in February? His vacation until we have 100 new cases daily? School closures really late in pandemic! California with more population and earlier first cases managed much better. We on third place,Massachusetts,school closures
2020-05-05 03:30:00+00:00,"""My goal was for the seniors to know that everyone is rooting for them and we can get through this."" Communities across MA are organizing gift exchange programs to honor high school seniors. ",Massachusetts,school closures
2020-05-04 21:35:05+00:00,Do you have a question for Supt. Salim and the CPS team? We’re producing a series of Virtual Forums to answer questions from families and staff about distance learning and other supports during school closure. Submit your Qs here: https://bit.ly/2Sr26Lh #CambPS #CambMA,Massachusetts,school closures
2020-05-04 17:47:07+00:00,"The story makes clear Summit is not an answer to COVID-related school closures. It also emphasizes student dislike of computers and describes the controversies you cite, linking to many of the same articles. See full version here: https://hechingerreport.org/a-personalized-learning-program-with-ties-to-zuckerberg-shows-promise-despite-criticism/",Massachusetts,school closures
2020-05-04 12:15:33+00:00,"@NewDay Once again reporting of #COVID19 public school closures is narrow &amp; biased. Why don’t you interview students &amp; parents whose schools are distance teaching new material online successfully? I you #alisyncamerota @JohnBerman, my respect for @CNN is diminished. #moms4FAPE",Massachusetts,school closures
2020-05-03 17:20:04+00:00,"""I think we all fear that the achievement and opportunity gaps that exist will be exacerbated by school closures."" http://ednxt.co/2KA7Eik @SuptEnfield",Massachusetts,school closures
2020-05-03 16:50:02+00:00,"From @NewsHour: Kids who receive #SpecialEducation services are facing a whole other layer of challenges with school closures. Parents are really feeling the pressure, and a sense of loss and frustration. https://to.pbs.org/2SoEl6K",Massachusetts,school closures
2020-05-02 13:24:33+00:00,"Yes-we will need to stop & reflect (at some point!) about what is working now (& what's not) and then slowly, thoughtfully redesign e-Learning for potential school closures in the fall. ",Massachusetts,school closures
2020-05-01 21:51:55+00:00,"Weymouth School Committee Meets to Discuss FY21 Budget Shortfall, Potential Closure of Nash School ",Massachusetts,school closures
2020-05-01 18:39:13+00:00,"Ts can make all kinds of wrong assumptions abt family involvement, esp now during #COVID19. This article frm @Tolerance_org can help to broaden our perspective and confront those assumptions: https://www.tolerance.org/magazine/rethinking-family-engagement-during-school-closures @BSU_CEHS @BSU_ed",Massachusetts,school closures
2020-05-01 16:12:00+00:00,"Pros of student IT teams: ""They are the ears and eyes out there because we can’t be in every single team meeting [and] every single class a teacher is hosting.""",Massachusetts,school closures
2020-05-01 15:23:38+00:00,"On this #DecisionDay, we want to shout out our KALC College Counseling team, and KIPP Through College and Career team. They are always stellar, but have gone above and beyond during school closure to support students and alumni. #edthataddsup #toandthrough #collegesigningday",Massachusetts,school closures
2020-05-01 14:24:12+00:00,"Research shows that 3-month school closures can cause students to fall almost a year behind. After COVID, millions of vulnerable children risk never returning to school or struggling to catch up. Back-to-school programs like ours give children a #SecondChance. #educationforall",Massachusetts,school closures
2020-05-01 14:19:15+00:00,8. Create a staff feedback mechanism 9. Document service delivery and share with parents 3/3 @dmgroupK12 #COVID #Education,Massachusetts,school closures
2020-05-01 14:19:14+00:00,Managing Special Education During School Closures: 1. Develop district-level guidance and protocols for converting IEP services to remote contexts 2. Revise IEPs and 504 plans to reflect updated remote services 3. Document all family communication and student services provided,Massachusetts,school closures
