date,text,state,query_term
2020-04-21 13:59:56+00:00,"Or you could institute a mandatory shelter-in-place order and lead by example in protecting the citizens in your state from further harm. Let’s be honest, is there a “safe” way to congregate en masse without masks if we are all potentially asymptomatic #COVID19 superspreaders?",Massachusetts,shelterinplace
2020-04-21 12:49:55+00:00,I would LOVE to know what’s on the wall at @ayeshacurry home that it has to be blurred out @TODAYshow @hodakotb #SweetJuly #ShelterInPlace,Massachusetts,shelterinplace
2020-04-18 21:39:43+00:00,Also worth it to acknowledge that the surrounding states have moved some of their dates of shelter in place to May 15. Personal opinion here: I think you may see a small lifting by June 15. Again key is testing and new cases which I believe new cases are down slightly.,Massachusetts,shelterinplace
2020-04-14 12:29:32+00:00,Not everyone can afford to be in a safe shelter during a ‘shelter in place’ order. Let’s remember that. ,Massachusetts,shelterinplace
2020-04-13 17:36:28+00:00,Trump doesn’t take responsibility for losing lives but claims he is saving lives. He wouldn’t order shelter in place but he will decide we’re open for business.,Massachusetts,shelterinplace
2020-04-11 22:41:19+00:00,Wondering what to do during COVID-19? Read! Educate yourself. Develop new skills and expertise. You will be in a great place when the shelter in place orders are lifted ,Massachusetts,shelterinplace
2020-04-10 20:16:09+00:00,"I am very confused why you think these are mutually exclusive. We need to social distance and shelter in place, AND have a means for people who opt in to have computer-assisted tracing in case you encounter someone during your necessary travel.",Massachusetts,shelterinplace
2020-04-09 12:51:22+00:00,Wish you used those last few squares of TP (instead of tossing them)? You know. The ones that are (very loosely) stuck to the cardboard roll?!?!? #COVIDー19 #Shelterinplace #ToiletPaperPanic,Massachusetts,shelterinplace
2020-04-09 00:15:04+00:00,"Sparks fly! Rebecca and Lex hit it off, and continue chatting after the seder is over. They develop a relationship while continuing to shelter in place, talking on the phone and online every day.",Massachusetts,shelterinplace
2020-04-06 17:04:47+00:00,"#city #shelterinplace #exercise Thanks #jumpsportfitness @Boston, Massachusetts https://www.instagram.com/p/B-par-0BQRH/?igshid=1h2sqfp097kmf",Massachusetts,shelterinplace
2020-04-04 22:59:38+00:00,"My housemates and neighbors are violating shelter in place, traveling back and forth between partners, friends, non-essential projects, and different states. It’s not going to stop, and neither will the curve, unless we #ShutDownMass",Massachusetts,shelterinplace
2020-04-03 12:25:03+00:00,"shelter in place, 2 weeks @MassGovernor I know it's not an easy decision, I know many things can go wrong during this, however..tough times call for tough decisions...shelter in place will save countless lives...please do the right thing ",Massachusetts,shelterinplace
2020-04-03 12:08:52+00:00,This shelter-in-place time is ripe for becoming better acquainted with our inner life and hear our Emerging Consciousness as it beckons us to be more trusting and to think and act from the heart. In the silence and… https://www.instagram.com/p/B-hKb7wluYg/?igshid=t8agonqe70yx,Massachusetts,shelterinplace
2020-04-02 12:30:06+00:00,"Despite the #shelterinplace of the #coronavairus #covid19 pandemic, we still must do good. We are raising awareness to the African diaspora about this years #census2020 day, via our #freedom2045 campaign. April 1st… https://www.instagram.com/p/B-eoEf9nVTz/?igshid=yo02ddqtlgvv",Massachusetts,shelterinplace
2020-04-07 15:48:52+00:00,Donald J. Trump: Urge the Trump Administration to issue a national Shelter-in-Place order STAT. - Sign the Petition! http://chng.it/B5pz5WPr via @Change,Minnesota,shelterinplace
2020-04-28 12:45:31+00:00,Kids feeling a little down due to the shelter in place order? How about you? Check out this video on YouTube &amp; bring some cheer by putting a in your window! “Rainbows in Windows” narrated by Donald Southerland- https://m.youtube.com/watch?feature=youtu.be&amp;v=SvtGI9YxPk4 #TeamDCS #SchoolCounselorsConnect,Mississippi,shelterinplace
2020-04-24 19:42:30+00:00,"Governor Tate Reeves announced Mississippi is shifting from a shelter-in-place order to a “Safer at Home” order, effective at 8 a.m. on April 27. Some restrictions lifted but people are encouraged to stay home unless essential travel is needed.",Mississippi,shelterinplace
2020-04-22 02:57:39+00:00,Disappointed in Cohen that he called Leach out on Twitter. Some things need to be handled privately. I am hoping that Leach returns to his tweeting self when all this Shelter in Place comes to a end.,Mississippi,shelterinplace
2020-04-21 00:09:29+00:00,"Meet Zachary Zee, Lewisburg High School Senior. His senior year has been cut short, & Saturday due to COVID-19 shelter in place he wasn’t able to perform at skills day and recieve his FF certificate, after completion of the 160 Hour course. #Classof2020 #TeamDCS",Mississippi,shelterinplace
2020-04-16 19:39:57+00:00,Picked these wildflower/weeds today at the neighborhood walking path around a large pond while in my walk/run. #Covid_19 #IsolationLife #ShelterInPlace #OliveBranch ~There is beauty everywhere.,Mississippi,shelterinplace
2020-04-14 21:33:53+00:00,Here’s hoping @misshsaa will figure out a way to give our children a fighting chance at normalcy by implementing activities opening back up once shelter in place is lifted! #weWILLwhenweCAN #WIDEOPENSPACES #SpringSports #baseballfamily,Mississippi,shelterinplace
2020-04-14 03:36:24+00:00,"I urge you to remain focused and demonstrate personal responsibility. Shelter-in-Place, stay home if you are sick and wash your hands... Mississippi we will get through this together!! ",Mississippi,shelterinplace
2020-04-11 17:21:57+00:00,He refused to order for safety even guideline's to shelter in place until many deaths and sickness. Now he thinks he can order State's to open on his command. He's such a danger to all American's. And he will try this. ,Mississippi,shelterinplace
2020-04-05 02:01:40+00:00,"Mississippi now has 1,455 confirmed cases of coronavirus. Let’s stop this enemy in its tracks by doing our part. #flatenthecurve #ShelterInPlace ",Mississippi,shelterinplace
2020-04-05 01:07:33+00:00,Shelter in place success day... #Karma is happy and I hope y’all are too!,Mississippi,shelterinplace
2020-04-04 03:56:10+00:00,First night of “Shelter in Place” is a wrap. Finished off my Blanton’s...hopefully my liver will make it to April 20th. ,Mississippi,shelterinplace
2020-04-04 00:10:26+00:00,a little ‘shelter in place’ therapy ,Mississippi,shelterinplace
2020-04-03 21:00:19+00:00,whole lotta folks around Mississippi about to be shocked to learn what ‘shelter in place’ means....,Mississippi,shelterinplace
2020-04-03 17:36:19+00:00,"The Lafayette County Board of Supervisors approved a third resolution, falling in line with Governor Reeves’ shelter-in-place order. They did add penalties of $500 fine or up to 6 months in jail if anyone is found in violation of the resolution.",Mississippi,shelterinplace
2020-04-03 16:33:36+00:00,This image isn’t indicative to Friday noon traffic on I-55. It seems Mississippians are taking heed to #ShelterInPlace a few hours early. Keep it up and let’s beat this thing Mississippi! ,Mississippi,shelterinplace
2020-04-03 13:54:14+00:00,"A “Shelter in Place” order for the entire state of MS begins today at 5 pm &amp; goes until Monday, April 20 at 8 am. Knowing the facts can help ease the stress associated with something we haven’t experienced before. Take a look below to learn more. #TeamDCS #SchoolCounselorsConnect",Mississippi,shelterinplace
2020-04-02 13:39:15+00:00,"What shelter in place should mean for everyone: Be still, and know that I am God: I will be exalted among the heathen, I will be exalted in the earth. Psalm 46:10 KJV",Mississippi,shelterinplace
2020-04-02 13:06:54+00:00,What does Mississippi’s shelter-in-place order mean for you? Check out the details from @Hattiesburg_MS,Mississippi,shelterinplace
2020-04-01 23:33:24+00:00,Came home to shelter in place w my family because I thought it would be more fun but then they placed me on oven duty while they went for a walk and I have to drive 20 minutes to Louisiana to simply visit the liquor store,Mississippi,shelterinplace
2020-04-01 22:19:59+00:00,Students be sure to get a laptop before we close on Friday at 3pm. We will not be open again until or April 20 or Governor lifts the shelter in place. Reserve yours today. @DrReginaHyatt @MSU_SA @MSUGSA @msstate,Mississippi,shelterinplace
2020-04-27 19:41:32+00:00,Agree hes so dangerous and should be accountable for all the State's deaths by refusing to order any shelter in place or closings as he should of in time.,Mississippi,shelterinplace
2020-04-17 19:25:33+00:00,"Read the book titles to find the quarantine message. Pretty neat. When in doubt, don’t go out. #StayHome #ShelterInPlace #WashYourHands #books #booktitles #quarentine2020 #COVID19",Mississippi,shelterinplace
2020-04-17 14:54:31+00:00,"The statewide #ShelterInPlace instituted in Executive Order 1466 is extended and shall remain in full force and effect until 8:00 a.m. on Monday, April 27, 2020 with a few exceptions that will be allowed AFTER Monday, April 20th, 8am!!! Governor @tatereeves announced today!",Mississippi,shelterinplace
2020-04-16 23:21:34+00:00,Governor Tate Reeves will announce his decision on the statewide shelter in place (set to expire on Monday) at 9 a.m. tomorrow,Mississippi,shelterinplace
2020-04-14 20:53:13+00:00,Could he have been less infomative of what that means? In same breath he fully expects us to lift shelter in place and have f2f learning in mid May early summer. Spring Sports should play in May and June then.,Mississippi,shelterinplace
2020-04-08 19:29:35+00:00,Happy birthday to me during this crazy shelter in place. Fortunately I’m surround by my family and amazing girlfriend ,Mississippi,shelterinplace
2020-04-07 12:34:57+00:00,"Churches and individuals... ring bells from the churches, and your porches, at 6:00 p.m. EVERY DAY, until the “Shelter in Place” is over, April 20, 2020 ",Mississippi,shelterinplace
2020-04-07 00:45:43+00:00,"Wayaminute. You mean to tell me that there was a shelter in place order starting at 5pm Friday &amp; jackasses had an impromptu car show at the park &amp; when the cops showed, they still refused to leave?! I don’t wish evil on people.. but WHAT THE FUCK. ",Mississippi,shelterinplace
2020-04-05 14:59:47+00:00,Being single hits differently when you’re under a Shelter In Place Order ...,Mississippi,shelterinplace
2020-04-05 04:08:16+00:00,Tostitos are great. @Tostitos scoops? #ShelterInPlace #littlethings,Mississippi,shelterinplace
2020-04-04 20:20:24+00:00,Are folks in your city adhering to this shelter-in-place order? ,Mississippi,shelterinplace
2020-04-04 15:59:42+00:00,@realDonaldTrump I appreciate your optimistic attitude everyday but FORCE these governors to do shelter in place all over the USA! #coronavirus,Mississippi,shelterinplace
2020-04-03 23:11:15+00:00,"Shelter in place is essentially in and of itself a curfew. Unfortunately, you have to spell it out for some people. Oxford is not like Prentiss in many ways. This is one of them.",Mississippi,shelterinplace
2020-04-03 20:37:39+00:00,JC loves the shelter-in-place order... His people are home and safe with him. ,Mississippi,shelterinplace
2020-04-02 17:24:02+00:00,Government: Shelter in place Ron! Ron: ,Mississippi,shelterinplace
2020-04-02 17:23:59+00:00,"To me, this is Ron Swanson without question. It also got me to thinking how entertaining a pandemic episode of Parks and Rec would be. Imagine his reaction to a shelter in place order. A thread: ",Mississippi,shelterinplace
2020-04-01 22:12:50+00:00,Basically the governor did a shelter in place but you don’t have to do it if you don’t want.. how will that help us?!,Mississippi,shelterinplace
2020-04-01 21:22:29+00:00,"I still don’t understand what has changed???????? Shelter in Place, Please tell me? Teans @NorrisGoDores @Brooksoak @coach_sinq @michaelfair52",Mississippi,shelterinplace
2020-04-01 17:32:09+00:00,Mississippi Gov. Tate Reeves finalizing plans for statewide shelter-in-place order after grim plea from a top doctor https://mississippitoday.org/2020/04/01/reeves-finalizing-plans-for-statewide-shelter-in-place-order-after-grim-plea-from-a-top-doctor/ via @MSTODAYnews/@GanucheauAdam,Mississippi,shelterinplace
2020-04-01 04:55:33+00:00,"Mississippi here, yep the “worst prepared in the nation.” Our right wing, toadie governor actually undermined local governments that were making tough decisions. As of today, one of 82 counties is under “shelter in place” orders.",Mississippi,shelterinplace
2020-04-29 09:51:43+00:00,Accelerated Urgent Care doctors recommend lifting shelter-in-place order https://www.turnto23.com/news/coronavirus/accelerated-urgent-care-doctors-recommend-lifting-shelter-in-place-order. This is what YouTube took off. They don’t want you to know some truth,Missouri,shelterinplace
2020-04-18 18:40:21+00:00,"AmeriCANS are getting tired of this China virus, shelter-in-place bull . https://youtu.be/AayyWcraB1I via @YouTube",Missouri,shelterinplace
2020-04-17 06:24:00+00:00,He was talking about it in January!!! That was time to issue shelter in place and either secure PPE OR tell states to if they’re in their own. Jesus @realDonaldTrump your lies are pathetic. @FLOTUS may buy it but we do not!! #Election2020 your done.,Missouri,shelterinplace
2020-04-16 15:09:48+00:00,@GovPritzker why is the Perry county sheriff on the news telling his community that he will not enforce your shelter in place order and they are free to congregate in church and other privately owned properties? He putting the counties around his in jeopardy too,Missouri,shelterinplace
2020-04-10 21:18:13+00:00,"I appreciate a ll efforts going to reduce the spread. Certian elements are beyond our control, but staying home is not one of them. I will sacrifice whatever it takes and am willing to shelter in place as long as needed in an effort to save lives.",Missouri,shelterinplace
2020-04-07 23:37:26+00:00,During this pandemic I’ve really looked back at my life 2008-2015. I can’t even fathom what it might have been like under a shelter-in-place order with my abuser in the same house. Yet many people are doing that right now.,Missouri,shelterinplace
2020-04-06 07:08:19+00:00,@KC_Sass &amp; @Girl_Censored good morning ladies. I’m in your area again. Just waving my hand . Anyone care to break shelter in place order with me?,Missouri,shelterinplace
2020-04-03 01:02:17+00:00,"Mr. Sorensen in St. Louis is a top-ranking executive for @FollowMercy (which includes @MercySGF), pleading with @GovParsonMO for a statewide shelter-in-place order, via Twitter ",Missouri,shelterinplace
2020-04-01 23:03:03+00:00,Shelter in place.,Missouri,shelterinplace
2020-04-15 20:57:13+00:00,"Trump did not do that. Dr. Fauci told the American people we needed to shelter in place. Most people did that. That's what is making the curve go down, not trump. He's basically done nothing. We don't have enough testing. There aren't enough medical supplies. Nothing.",Nevada,shelterinplace
2020-04-17 18:41:01+00:00,Allstate’s Shelter in Place Payback. Thank you to Allstate customers. Allstate will be send out payments beginning next week. You are in Good Hands at Allstate. Call us at 603-536-5161 for questions. @Sharon… https://www.instagram.com/p/B_F55lsnTrp/?igshid=bxe0frtu94sn,New Hampshire,shelterinplace
2020-04-24 21:16:38+00:00,"If the only vaccine we have now is 2 shelter in place, then the universal need for safe, stable home within walking distance 2 public green spaces becomes urgently more compelling &amp; absolutely essential. We need affordable #housing , we need #parks; this is not binary. #COVID19",New York,shelterinplace
2020-04-20 20:47:44+00:00,The controversy is that Sweden decided not to shut down their economy and they’re not worse off than the countries that did shelter-in-place. Should the US do what Sweden is doing? ,New York,shelterinplace
2020-04-19 14:07:06+00:00,"Republicans have successfully co-opted the national narrative from ""Why isn't there national #ShelterInPlace mandate or national #COVIDTesting"" to ""When will these states re-open?"" It's dangerous, misinformed, and evil #COVIDIOTS",New York,shelterinplace
2020-04-18 12:13:14+00:00,Time for Upstate revolt against Cuomo’s tyranny. One size fits all New York while he preens every day to go where his father didn’t with a self indulgent/promoting filibustering narrative to cover his days quibbling “shelter in place” while virus stealthily conquered Downstate. ,New York,shelterinplace
2020-04-16 21:03:05+00:00,"#covid_19 brings awareness about #equity, but once our #shelterinplace is over these discussions about #MentalHealthAwareness, #selfcare , #resilience, and the inequalities of our hierarchy need to change our system. @Teach4Trust ‘s webinar helped me with my first steps.",New York,shelterinplace
2020-04-16 19:58:10+00:00,“Supporting Educator Resilience During Shelter In Place” w/@Teach4Trust Fostering Student Resilience During Shelter in Place and additional resources Thanks Ricky...appreciate you! Btw if you are not following Ricky Robertson...you should! ,New York,shelterinplace
2020-04-16 19:44:48+00:00,“Supporting Educator Resilience During Shelter In Place” w/@Teach4Trust What things are w/in your sphere of influence? What can’t you control? What is something you can do each day to support your mental &amp; emotional well-being? What are you doing to be socially connected?,New York,shelterinplace
2020-04-15 16:27:00+00:00,"Today is the 75th anniversary of the liberation of the Nazi concentration camp at Bergen-Belsen. As we shelter in place, let’s recommit to building a world in which we consistently uphold our responsibility to protect all vulnerable populations from mass atrocity crimes. #R2P",New York,shelterinplace
2020-04-15 14:29:35+00:00,"A father-son #QuaratineLife jam from @MONOMUKUNDU. The data on the impact of shared activity like this, long-term, esp. during a shelter-in-place world, is really incredible. ",New York,shelterinplace
2020-04-14 13:56:45+00:00,"Every April all around the world people gather together to commemorate the genocide in Rwanda, Cambodia & Armenia. As we shelter in place &amp; demagogues try to use the #COVID19 pandemic to divide humanity, let’s learn the lessons of history.",New York,shelterinplace
2020-04-12 15:07:31+00:00,"Just wanna remind y’all that on some real shit @NYGovCuomo won’t suspend rent because he needs to keep poor families desperate enough that they sign themselves up for the slaughter and fight on the frontlines of this pandemic, while his donors comfortably ~shelter-in-place~",New York,shelterinplace
2020-04-11 17:55:16+00:00,"3/17 DeBlasio: NYC needs to shelter in place Cuomo: OH NO YOU DON'T 3/20 (3 days later) Cuomo: let's shelter in place but call it a ""pause"" 4/11 (today) DeBlasio: NYC schools closed until end of school year Cuomo: OH NO YOU DON'T",New York,shelterinplace
2020-04-11 11:11:41+00:00,President of the Claremont Institute calls for “resistance and civil disobedience” against shelter-in-place orders. ,New York,shelterinplace
2020-04-09 01:09:13+00:00,"As one such media member, I would like to personally apologize for not ordering New York to shelter in place sooner. ",New York,shelterinplace
2020-04-06 14:46:35+00:00,"NEW: It’s proportionally way too big for the yard, but here’s latest shelter in place set up. ",New York,shelterinplace
2020-04-05 12:33:28+00:00,— N95 — Pandemic — Shelter-in-place — Epidemiology — Epistemics — Pandemic — Zoom — Zoombombing — Furloughs — Zoonotic — Droplet — Superspreader — Epicenter — Ventilator — Intubation — Herd Immunity — Social isolation,New York,shelterinplace
2020-04-05 02:01:16+00:00,"Before shelter in place, there was a core group of us who would gather for themed dinner parities. We’re not letting coronavirus stop us. This week’s theme, bar food. We went with fried chicken, lemon butter mashed potatoes, whole leaf Caesar salad. #QuarantineCooking",New York,shelterinplace
2020-04-03 18:40:50+00:00,"Football may be stopped but here’s a ray of sunshine. “The voice of the fans”, @RedsIndependent delivers from the banks of the Tolka to NYC. #shelbournefc #Shels #shelterinplace ",New York,shelterinplace
2020-04-01 21:43:17+00:00," this is truly , 530pm in #NYC . One indication that NY’ers are taking #shelterinplace seriously. Roads are clear for our most essential workers to do their jobs and keep us safe at home ... #silverlinings",New York,shelterinplace
2020-04-01 16:03:37+00:00,Please avoid grocery shopping April 1-3 unless you have a critical need so that families eligible for WIC/SNAP benefits can get the goods they need. Pass it on. #coronavirus #ShelterInPlace #COVIDー19,New York,shelterinplace
2020-04-27 23:08:54+00:00,"Every time I think about how my home state of Arkansas still has no shelter-in-place order &amp; meanwhile Senator Tom Cotton keeps touting anti-Chinese/white supremacist ideology on Fox News, I... ",New York,shelterinplace
2020-04-27 15:59:47+00:00,This made me laugh a bit too hard (laughing not to cry) #TrumpLiesAmericansDie #COVIDIOT #COVID19 #CoronavirusPandemic #QuarantineLife #ShelterInPlace #EnemyOfThePeople,New York,shelterinplace
2020-04-26 16:36:36+00:00,#breaking - upstate #newyork excluding #NewYorkCity could begin the #reopening process as early as May 15 if #COVID19 hospitalizations and deaths continue to decline - #ShelterInPlace #NYCLockdown #coronavirus #May15 – at Times Square,New York,shelterinplace
2020-04-24 13:04:51+00:00,Today is #NationalDayofSilence. Everyday we should ensure that no one is silenced for their identity. How are we making sure our LGBTQ+ students are welcomed into their homes during this #shelterinplace. https://www.youtube.com/watch?v=iAwJQYs7pKM @GLSEN,New York,shelterinplace
2020-04-22 17:11:30+00:00,"Now that I know I am not COVID positive, can I transfer my shelter in place to Puerto Rico? I just want to be home...",New York,shelterinplace
2020-04-19 03:57:26+00:00,"Happy 3-month anniversary @BenForer. This isn’t exactly how I pictured the first few months of married life, but we’re over a month into shelter-in-place in a tiny NY apartment and I still… https://www.instagram.com/p/B_Je6ddJAPa4dyBWrAS6nNhurAc3caPdZW6isE0/?igshid=lob0whxgs35d",New York,shelterinplace
2020-04-18 20:01:22+00:00,"When @inquiringjoy and @graemeburk ask to do a Reality Bomb ""Live"": Shelter In Place edition, you put on a red lip and some Cybermanesque recording headphones and have the most fun you've had in weeks. @New… https://www.instagram.com/p/B_IobyagCjE/?igshid=1du3xiqndse2v",New York,shelterinplace
2020-04-18 15:32:57+00:00,Feeling grateful this morning that my family live in states with good shelter-in-place policies and effective leadership.,New York,shelterinplace
2020-04-18 12:49:02+00:00,"Cuomo filibusters tough questions w imperial rhetoric; timely departure, work finished, to prepare next episode of self promoting/indulgent narrative on national stage. Problem: he fiddled with words “shelter in place” while virus burned City &amp; imprisoned Upstate #springUpstate",New York,shelterinplace
2020-04-16 16:22:26+00:00,Officially celebrating my birthday in Quarantine bc NYC rightfully so extended the shelter in place orders to may 15 Yeah I hate it.,New York,shelterinplace
2020-04-14 21:34:56+00:00,My little yoga studio Spending more time at home means having more time to devote to my meditative practice &amp; yoga flow. Taking time to be thankful for every little daily positive that comes my way. How about you? #shelterinplace #covid19 #yogapractice #meditation #actorslife,New York,shelterinplace
2020-04-14 17:40:54+00:00,#Repost #AmySedaris ・・・ #JoanCrawford #ShelterInPlace More info in the next tweet ,New York,shelterinplace
2020-04-11 23:14:04+00:00,7 pm cheer for the #HealthcareHeroes #healthcareworkers #trumpvirus #NYCstrong #ShelterInPlace #WearAMask #coronavirus #FlattenTheCurve #VoteBlue – at Convent Garden,New York,shelterinplace
2020-04-10 13:07:31+00:00,#twentyfour ing this way to pass time during #ShelterInPlace (re)watch videos from some of my favorite trips #VirtualVacation @Sept11Memorial #911memorial #NeverForget #911museum #NYC @NYC – at 3 World Trade Center,New York,shelterinplace
2020-04-07 00:12:50+00:00,"Guys, I have a quarantine bae I met before shelter in place (he’d kill me for posting but he doesn’t have Twitter) WFH day 1 together went well, I think. Not sure how to deal with Zoom etiquette. Send advice ",New York,shelterinplace
2020-04-05 04:25:39+00:00,"I am not a big fan of the mayor. However, he wanted to order NYC to shelter in place, and Cuomo (who I think is doing a great job) overruled him and wouldn’t let him.",New York,shelterinplace
2020-04-04 21:51:48+00:00,"A national shelter in place should have been implemented two weeks ago , maybe earlier. A very well thought out one where only deliveries, health care, FRs, and extreme essential workers were out. No joggers, shoppers, or any of those sorts. What is so hard about that? ",New York,shelterinplace
2020-04-03 09:29:20+00:00,"Pat Buchanan, asking the tough questions: ""Will MS-13 and its thousands of members, and its rival gangs that live off narcotics sales, comply [with shelter in place]?"" FFS ",New York,shelterinplace
