date,text,state,query_term
2020-04-01 01:46:17+00:00,Hey @PetSmart thank you so much for the coupon for our dogs birthday! Classy move making it in-store only and expiring the day after CDC shelter in place guidance ends. Real helpful.,Washington,shelterinplace
2020-04-01 00:06:45+00:00,"30 minute cardio workout in the books with lia_bball basketballmomlifex3 #shelterinplace #quarantinelife #dowhatyoucando #fitnessmotivation #athomeworkouts @Greater Upper Marlboro, Maryland https://www.instagram.com/p/B-auNRtFNvk/?igshid=1i1h0c45h6mr8",Washington,shelterinplace
2020-04-24 00:38:29+00:00,Lions pick and then I’m gone. This is worse than shelter in place.,Wyoming,shelterinplace
2020-04-23 07:02:58+00:00,March & April show that jump right around the shelter in place. ,Wyoming,shelterinplace
2020-04-16 00:01:14+00:00,Today I learned that remote learning solutions for 1st graders are hot garbage. #homeschool #shelterinplace #distancelearning,Wyoming,shelterinplace
2020-04-05 22:30:11+00:00,"It’s been a very puzzling weekend , between bike rides &amp; Zoom gatherings.... not a bad start to a shelter-in-place Spring Break. @Grandville, Michigan https://www.instagram.com/p/B-nbIPnjzpn/?igshid=1r7p2ri4n2uww",Wyoming,shelterinplace
2020-04-05 18:53:45+00:00,Check-in time! How is everyone doing? Are you able to focus on reading while a lot of us shelter in place? Maybe we can share some tips for relaxing below.. Womenreadingwithcats #womeneading #readmore #quarantine… https://www.instagram.com/p/B-nCXLojp5U/?igshid=1ddix64s3lry6,Wyoming,shelterinplace
2020-04-03 13:08:08+00:00,"The fastest way to recover is to end the spread of #COVID19, which means keeping shelter in place as long as needed. ",Wyoming,shelterinplace
2020-04-02 16:39:07+00:00,Will the Shelter in Place be extended?,Wyoming,shelterinplace
2020-04-14 17:26:36+00:00,"Cool take, man. Totally misses the point of what we were saying. But sure. Scalpers taking advantage of shelter in place and jacking prices is TOTALLY acceptable… ",Wyoming,shelterinplace
